"SourceFile","RangeStartDate","RangeEndDate","AwardDate","AwardNoticeDate","TenderCaseNo","TenderName","TenderOrgName","TenderOrgAddr","ContactPerson","TenderTel","ProcurementType","ProcurementAttr","TenderAwardWay","TenderAwardPrice","BidderSuppName","BidderSuppAddr","NotObtainSuppName"
"award_20200401.xml","2020/04/01","2020/04/15","2020/04/01","2020/04/14","A1090258ENG010","金門機場24跑道ILS/DME設備遷架案","交通部民用航空局飛航服務總臺","105臺北市松山區濱江街362號","林妍君","(02)87702215分機","限制性招標(未經公開評選或公開徵求)","財物類","最低標","9500000","葳鎮企業有限公司","114臺北市內湖區潭美街588號7樓",""
"award_20200401.xml","2020/04/01","2020/04/15","2020/04/01","2020/04/15","109003","108年度所得稅結算申報資訊設備租賃、移機及環境建置案","財政部北區國稅局","330桃園市桃園區三元街156號","劉鎧源","(03)3396789分機1823","限制性招標(經公開評選或公開徵求)","勞務類","準用最有利標","5160000","神通資訊科技股份有限公司","114臺北市內湖區堤頂大道2段187號10樓",""
"award_20200401.xml","2020/04/01","2020/04/15","2020/04/01","2020/04/22","10902407790","零售業上架電商服務推動計畫","經濟部","100臺北市中正區福州街15號","許美玲","(02)23212200分機8939","限制性招標(未經公開評選或公開徵求)","勞務類","最低標","12800000","財團法人中國生產力中心","221新北市汐止區新台五路一段79號2樓",""
"award_20200401.xml","2020/04/01","2020/04/15","2020/04/01","2020/04/07","109A161","109-110年度綠色生活網絡經營管理暨行銷專案工作計畫","行政院環境保護署","100臺北市中正區中華路一段83號","蔣憶玲;江家慧","(02)23117722分機2922;2455","限制性招標(經公開評選或公開徵求)","勞務類","準用最有利標","10720000","環資國際有限公司","108臺北市萬華區中華路1段90號7樓",""
"award_20200401.xml","2020/04/01","2020/04/15","2020/04/01","2020/04/06","G109-022","內政部消防署訓練中心109年消防模擬訓練設施保養維護及功能提升、強化採購案","內政部消防署","231新北市新店區北新路3段200號8樓","張幸如","(02)89114119分機9125","限制性招標(未經公開評選或公開徵求)","財物類","最低標","10100000","香港商凱德實火消防設備有限公司台灣分公司","105臺北市松山區南京東路五段202號三樓",""
"award_20200401.xml","2020/04/01","2020/04/15","2020/04/01","2020/04/09","109A119","精進生活廢棄物減量、清理管理專案工作計畫","行政院環境保護署","100臺北市中正區中華路一段83號","盧曉宜;劉美玲","(02)23117722分機2621;2468","限制性招標(經公開評選或公開徵求)","勞務類","準用最有利標","8250000","環興科技股份有限公司","105臺北市松山區南京東路5段171號12樓","財團法人台灣產業服務基金會"
"award_20200401.xml","2020/04/01","2020/04/15","2020/04/01","2020/04/09","109A105","溫室氣體排放源排放量監測及查核管理制度研析檢討計畫","行政院環境保護署","100臺北市中正區中華路一段83號","張原道;周宜妙","(02)23117722分機2772;2482","限制性招標(經公開評選或公開徵求)","勞務類","準用最有利標","9520000","環科工程顧問股份有限公司","106臺北市大安區忠孝東路4段280號8樓",""
"award_20200401.xml","2020/04/01","2020/04/15","2020/04/01","2020/04/06","3520800203","核三廠一、二號機氣動控制閥維修工作","台灣電力股份有限公司第三核能發電廠","946屏東縣恆春鎮南灣路387號","林昱豪","(08)8893470分機3047","公開招標","勞務類","最低標","21840000","裕旺工程有限公司","802高雄市苓雅區正義路294號2樓",""
"award_20200401.xml","2020/04/01","2020/04/15","2020/04/06","2020/04/09","s109007","三爺溪中下游治理工程(後壁厝排水口至文賢排水出口)(四~六工區)委託設計監造技術服務","經濟部水利署第四河川局","524彰化縣溪州鄉尾厝村中山路三段640號","童正安","(04)8890534分機","限制性招標(經公開評選或公開徵求)","勞務類","準用最有利標","24960000","黎明工程顧問股份有限公司","408臺中市南屯區大墩十七街137號3樓","禹安工程顧問股份有限公司"
"award_20200401.xml","2020/04/01","2020/04/15","2020/04/06","2020/04/10","MEA0700008","管線智慧型通管器(IP)檢測工作","台灣中油股份有限公司","110臺北市信義區松仁路3號19樓","黃凱民","(02)87258313分機","公開招標","勞務類","最低標","25513514","信陵企業有限公司","811高雄市楠梓區後昌路853巷27號","羅森企業有限公司"
"award_20200401.xml","2020/04/01","2020/04/15","2020/04/06","2020/04/16","109Y110","109年本分署照明設備汰換為LED燈具採購案","勞動部勞動力發展署桃竹苗分署","326桃園市楊梅區秀才路851號","蔡紫文","(03)4855368分機1134","公開招標","財物類","最有利標","12858000","寶駿國際企業有限公司","326桃園市楊梅區四維里四維路200號1樓","方晨科技股份有限公司"
"award_20200401.xml","2020/04/01","2020/04/15","2020/04/06","2020/04/07","1090101P0008","109年度北投廠廢氣及壓縮空氣供應系統廠區二樓脫硝空壓機等相關設備整修更新","臺北市政府","110臺北市信義區巿府路一號3樓","潘珮榆","(02)27208889分機1144","公開招標","財物類","最低標","9269820","復盛股份有限公司","241新北市三重區光復路2段60號","坤皝機械股份有限公司"
"award_20200401.xml","2020/04/01","2020/04/15","2020/04/06","2020/04/08","109D010P004","國道10號2k+423~7k+979高雄環線高架(二)橋結構補強工程","交通部高速公路局南區養護工程分局","701臺南市東區裕農路991號","王柏仁","(06)2363201分機2208","公開招標","工程類","最有利標","241800000","宏義工程股份有限公司","220新北市板橋區中正路80巷7之1號2樓","文銓營造有限公司"
"award_20200401.xml","2020/04/01","2020/04/15","2020/04/01","2020/05/26","CAA1050222-4","「北竿機場跑道改善評估及綜合規劃」委託技術服務案(契約變更)","交通部民用航空局","105臺北市松山區敦化北路340號","張峰齊","(02)87701225分機","限制性招標(未經公開評選或公開徵求)","勞務類","最低標","7100000","法商巴黎工程顧問股份有限公司台灣分公司","105臺北市松山區東光里南京東路5段171號14樓",""
"award_20200401.xml","2020/04/01","2020/04/15","2020/04/06","2020/04/22","B108056","三爺溪中下游治理工程文賢排水出口至二仁溪匯流口五工區六工區七工區委託測設監造","經濟部水利署第六河川局","820高雄市岡山區柳橋西路15號","陳有慶/張竣閔","(07)6279041分機","限制性招標(經公開評選或公開徵求)","勞務類","準用最有利標","15870000","鴻威國際工程顧問股份有限公司","813高雄市左營區博愛二路366號17樓之6","崇峻工程顧問有限公司"
"award_20200401.xml","2020/04/01","2020/04/15","2020/04/07","2020/04/08","3710900058","過氧化氫約15,600,000公斤","台灣電力股份有限公司台中發電廠","434臺中市龍井區麗水里龍昌路1號","王雅鈴","(04)26302123分機2632","公開招標","財物類","最低標","21294000","利峻企業有限公司","100臺北市中正區中華路1段95巷2號4樓","合揚興業股份有限公司"
"award_20200401.xml","2020/04/01","2020/04/15","2020/04/07","2020/04/08","109LC0021K","109年度第四代電腦售票機(TPT)背磁票紙20,000捲","交通部臺灣鐵路管理局","100臺北市中正區北平西路3號5樓","高小姐/劉先生","(02)23815226分機3562/2207","公開招標","財物類","最低標","17472000","利百代國際實業股份有限公司","104臺北市中山區中山北路2段45巷21之1號6樓","科進有限公司"
"award_20200401.xml","2020/04/01","2020/04/15","2020/04/07","2020/04/10","109A175","109-110年度綠色採購及消費推廣專案工作計畫","行政院環境保護署","100臺北市中正區中華路一段83號","蔣憶玲;江家慧","(02)23117722分機2922;2455","限制性招標(經公開評選或公開徵求)","勞務類","準用最有利標","9120000","財團法人台灣產業服務基金會","106臺北市大安區四維路198巷39弄14號1樓",""
"award_20200401.xml","2020/04/01","2020/04/15","2020/04/07","2020/04/08","3410900040-S09018","興一機爐底出灰設備(S.S.C系統)大修工作","台灣電力股份有限公司興達發電廠","828高雄市永安區鹽田里興達路六號","黃全興","(07)6912811分機3351","公開招標","勞務類","最低標","16747500","勝發行股份有限公司","104臺北市中山區龍江路370巷4號1樓","鉦濠企業有限公司"
"award_20200401.xml","2020/04/01","2020/04/15","2020/04/07","2020/04/14","ZH109007","109年度溫度監視片62,000片及冷凍監視片15,200片","衛生福利部疾病管制署","100臺北市中正區林森南路六號6樓","鄭子麾","(02)23959825分機3786","限制性招標(未經公開評選或公開徵求)","財物類","最低標","5443200","台灣明尼蘇達礦業製造股份有限公司","115臺北市南港區經貿二路198號3樓至8樓",""
"award_20200401.xml","2020/04/01","2020/04/15","2020/04/07","2020/04/10","1080104825","本處轄區高雄市轄管省道109年度工程委託鑽探、測量設計、水保監造及生態檢核服務工作(開口契約)","交通部公路總局第三區養護工程處","920屏東縣潮州鎮光復路259號","養護科蘇仲佑","(08)7893456分機1204","限制性招標(經公開評選或公開徵求)","勞務類","準用最有利標","9728676","黎明工程顧問股份有限公司","408臺中市南屯區大墩十七街137號3樓","山水技術服務有限公司"
"award_20200401.xml","2020/04/01","2020/04/15","2020/04/07","2020/04/14","4850900012","北港P/S等3所34.5kV及69kV空斷開關採購含安裝","台灣電力股份有限公司","730臺南市新營區太子路137號","廖珮妗","(06)6563711分機311","選擇性招標(建立合格廠商名單後續邀標)","財物類","最低標","15750000","士林電機廠股份有限公司","111臺北市士林區忠誠里19鄰中山北路6段88號12樓",""
"award_20200401.xml","2020/04/01","2020/04/15","2020/04/07","2020/04/14","109f500072","中部科學園區臺中園區擴建用地(原大肚山彈藥分庫)開發計畫第四次環評變更作業","科技部中部科學園區管理局","407臺中市西屯區中科路2號","盧德笙(規範)/陳家榮(招標)","(04)25658588分機7937/6925","限制性招標(經公開評選或公開徵求)","勞務類","準用最有利標","39515813","環興科技股份有限公司","105臺北市松山區南京東路5段171號12樓",""
"award_20200401.xml","2020/04/01","2020/04/15","2020/04/07","2020/04/13","1090206A","109年文化部文物典藏管理系統維運、擴充暨導入案","文化部","242新北市新莊區中平路439號南棟13樓","朱純慧","(04)22176326分機","限制性招標(經公開評選或公開徵求)","勞務類","準用最有利標","6280000","博淵科技有限公司","404臺中市北區明德里太原南二街159號10樓之1",""
"award_20200401.xml","2020/04/01","2020/04/15","2020/04/07","2020/04/15","109B008-1","109-110年度飼料原料財物採購－魚粉110公噸","行政院農業委員會畜產試驗所","712臺南市新化區牧場一一二號","王瓊珠、李宗育","(06)5911211分機2071 2650","公開招標","財物類","最低標","4620000","權品實業有限公司","708臺南市安平區平通里育平路435號1樓",""
"award_20200401.xml","2020/04/01","2020/04/15","2020/04/07","2020/04/09","1082F154","用戶水量計自動讀表傳輸介面一批(均含安裝、電源及通訊)(詳規範)","台灣自來水股份有限公司","404臺中市北區雙十路二段2號之1","徐泰景","(04)22244191分機804","公開招標","財物類","最低標","19579425","亞太電信股份有限公司","114臺北市內湖區基湖路32號8樓","台灣恩益禧股份有限公司"
"award_20200401.xml","2020/04/01","2020/04/15","2020/04/07","2020/04/14","UM081600","總分院及癌醫中心醫院骨材單價合約一批招標案","國立臺灣大學醫學院附設醫院","100臺北市中正區中山南路7號","陳玲玲","(02)23562039分機","選擇性招標(個案)","財物類","最低標","76320000","世邦有限公司","104臺北市中山區吉林路258號2樓",""
"award_20200401.xml","2020/04/01","2020/04/15","2020/04/07","2020/04/15","LP5-108053","室內LED燈具","臺灣銀行股份有限公司","100臺北市中正區武昌街一段45號","開標一科","(02)23493456分機7661","公開招標","財物類","最低標","881925655","宏宜企業社","950臺東縣臺東市漢陽南路28巷67號","毅宇系統科技有限公司"
"award_20200401.xml","2020/04/01","2020/04/15","2020/04/07","2020/04/09","1082B035","延性鑄鐵管(K型第三種管)等乙批","台灣自來水股份有限公司第二區管理處","324桃園市平鎮區水廠路150號","黃韻儒","(03)4643131分機791","公開招標","財物類","最低標","48790148","錦源鑄造工業股份有限公司","104臺北市中山區建國北路1段69號9樓",""
"award_20200401.xml","2020/04/01","2020/04/15","2020/04/07","2020/04/14","UM081610","總分院及癌醫中心醫院骨材單價合約一批招標案","國立臺灣大學醫學院附設醫院","100臺北市中正區中山南路7號","陳玲玲","(02)23562039分機","選擇性招標(個案)","財物類","最低標","262369040","麥迪斯生物科技股份有限公司","114臺北市內湖區新湖一路71號3樓",""
"award_20200401.xml","2020/04/01","2020/04/15","2020/04/07","2020/04/08","1084B160","玉里工務段瑞穗監工站109年度路容維護工作","交通部公路總局第四區養護工程處","270宜蘭縣蘇澳鎮中山路2段3號","養護科顏錫堅","(03)9962501分機2310","公開招標","勞務類","最低標","6780000","東輝企業社(獨資)","970花蓮縣花蓮市國華里林森路273巷69號１樓","福鵬企業社(獨資)"
"award_20200401.xml","2020/04/01","2020/04/15","2020/04/07","2020/04/08","1082M244","延性鑄鐵管600mm(K3型管)6,630公尺","台灣自來水股份有限公司","404臺中市北區雙十路二段2號之1","許元鴻","(04)22244191分機806","公開招標","財物類","最低標","31549518","錦源鑄造工業股份有限公司","104臺北市中山區建國北路1段69號9樓","興南鑄造廠股份有限公司"
"award_20200401.xml","2020/04/01","2020/04/15","2020/04/07","2020/04/17","CW109020","109年度四價流感疫苗採購案","衛生福利部疾病管制署","100臺北市中正區林森南路6號","施雲瑞[規格]/楊其巍[招標]","(02)23959825分機3698/3775","限制性招標(未經公開評選或公開徵求)","財物類","最低標","1428596720","賽諾菲股份有限公司","110臺北市信義區松仁路3號7樓",""
"award_20200401.xml","2020/04/01","2020/04/15","2020/04/07","2020/04/23","109-3-00011","109年度桃園機場行李再確認系統手持機採購案","桃園國際機場股份有限公司","337桃園市大園區航站南路9號","李知穎","(03)2733664分機","公開招標","財物類","最低標","19897500","新鼎系統股份有限公司","111臺北市士林區中山北路6段89號10樓",""
"award_20200401.xml","2020/04/01","2020/04/15","2020/04/07","2020/04/20","1090023654","澎湖工務段109年度縣道路容維護工作","交通部公路總局第三區養護工程處","920屏東縣潮州鎮光復路259號","養護科曾鈴雅","(08)7893456分機1212","公開招標","勞務類","最低標","4745000","翊群營造有限公司","880澎湖縣馬公市陽明里中華路218之2號2樓","建川企業行(獨資)"
"award_20200401.xml","2020/04/01","2020/04/15","2020/04/08","2020/04/09","109036F","心臟內科血管成形系統導引線等13項耗材兩年單價開口契約","臺北榮民總醫院","112臺北市北投區石牌路2段201號","王玫淳","(02)28757245分機","公開招標","財物類","最低標","3600000","法蘭德生技有限公司","433臺中市沙鹿區北勢里北中六街15號1樓","美商亞培股份有限公司台灣分公司"
"award_20200401.xml","2020/04/01","2020/04/15","2020/04/08","2020/04/10","08IF11","重油加氫脫硫工場觸媒及墊球 1Lot","台灣中油股份有限公司","110臺北市信義區松仁路3號19樓","丁專枝","(02)87258208分機","公開招標","財物類","最低標","42703205","CENTRAL UNION INTERNATIONAL INC.","999Suite310, Griffith Corporate Centre, Beachmont, Kingstown, St. Vincent and the Grenadines","GCO INTERNATIONAL(H.K.) LTD"
"award_20200401.xml","2020/04/01","2020/04/15","2020/04/08","2020/04/13","0080820089","數位式斷路器失靈保護電驛乙批","台灣電力股份有限公司","100臺北市中正區羅斯福路3段242號8樓","蔡承峰","(02)23667546分機","公開招標","財物類","最低標","11056500","艾波比股份有限公司","114臺北市內湖區基湖路18號10樓","聯笙電業股份有限公司"
"award_20200401.xml","2020/04/01","2020/04/15","2020/04/08","2020/04/13","1070900007","地下配電線路接地組一批","台灣電力股份有限公司嘉義區營業處","60001嘉義市東區垂楊路223號","張珮君","(05)2226711分機2436","公開招標","財物類","最低標","19258046","台灣翔登股份有限公司","366苗栗縣銅鑼鄉銅鑼村23鄰民治路37號",""
"award_20200401.xml","2020/04/01","2020/04/15","2020/04/08","2020/04/10","SBIP-108-023","「銅鑼科學園區污水處理廠第二期工程－導電度處理設施功能提昇」統包工程","科技部新竹科學園區管理局","30001新竹市東區新安路2號","林義翔","(03)5773311分機2525","公開招標","工程類","最有利標","2105680000","欣達環工股份有限公司","106臺北市大安區敦化南路2段95號15樓","建越科技工程股份有限公司"
"award_20200401.xml","2020/04/01","2020/04/15","2020/04/08","2020/04/13","10901","飛航管制塔臺模擬機結構暨軟、硬體設備更新","交通部民用航空局民航人員訓練所","105臺北市松山區濱江街362號","詹端香","(02)87703639分機","限制性招標(未經公開評選或公開徵求)","勞務類","最低標","16400000","化育科技股份有限公司","30002新竹市香山區五福路1段11巷8弄8號1樓",""
"award_20200401.xml","2020/04/01","2020/04/15","2020/04/08","2020/04/09","109A127","109年度前瞻河川水質環境管理計畫（南區）","行政院環境保護署","100臺北市中正區中華路一段83號","汪士鈞 許惠琮","(02)23117722分機2849 2456","限制性招標(經公開評選或公開徵求)","勞務類","準用最有利標","15300000","磐誠工程顧問股份有限公司","802高雄市苓雅區海邊路31號22樓之1",""
"award_20200401.xml","2020/04/01","2020/04/15","2020/04/08","2020/04/16","6550851046","北港~四湖雙分歧澎湖161kV線(第三期)電纜管路設計及施工統包工程","台灣電力股份有限公司輸變電工程處中區施工處","420臺中市豐原區中山路209號","陳采玲","(04)25211507分機","公開招標","工程類","最有利標","238800000","展慶營造股份有限公司","802高雄市苓雅區六合路42號2樓",""
"award_20200401.xml","2020/04/01","2020/04/15","2020/04/08","2020/04/20","3-1081114","109年南投收容所伙食採購案","內政部移民署","100臺北市中正區廣州街15號","張先生","(02)23889393分機2752","限制性招標(經公開評選或公開徵求)","勞務類","準用最有利標","13585920","玉美研究股份有限公司","408臺中市南屯區工業區二十一路50號","梅景食品股份有限公司台中分公司"
"award_20200401.xml","2020/04/01","2020/04/15","2020/04/08","2020/04/09","109TA-AA-1-11","阿里山森林鐵路42號隧道計畫","行政院農業委員會林務局阿里山林業鐵路及文化資產管理處","60001嘉義市東區文化路308號","連祥益","(05)2779843分機166","公開招標","工程類","最有利標","354600000","利德工程股份有限公司","100臺北市中正區館前路20號9樓",""
"award_20200401.xml","2020/04/01","2020/04/15","2020/04/08","2020/04/16","109010","工程救險吊車3輛","交通部公路總局","108臺北市萬華區東園街65號","黃千惠","(02)23070123分機5504","公開招標","財物類","最低標","13395000","長源汽車股份有限公司","104臺北市中山區松江路121號10樓","捷喜國際股份有限公司"
"award_20200401.xml","2020/04/01","2020/04/15","2020/04/08","2020/04/09","MDJ0850003","溪州資源廠停爐歲修工作","台灣中油股份有限公司","110臺北市信義區松仁路3號19樓","蔡介山","(02)87258335分機","公開招標","勞務類","最低標","38900000","啟新化工股份有限公司","110臺北市信義區基隆路2段125號5樓",""
"award_20200401.xml","2020/04/01","2020/04/15","2020/04/08","2020/04/09","UD090020","鎝-99m MIBI分裝注射劑組","國立臺灣大學醫學院附設醫院","100臺北市中正區中山南路7號","李偉群","(02)23562239分機","公開招標","財物類","最低標","22790000","臺灣新吉美碩股份有限公司","106臺北市大安區復興南路1段237號11樓",""
"award_20200401.xml","2020/04/01","2020/04/15","2020/04/09","2020/04/13","2050800055","明潭壹號廠用電變壓器採購帶安裝","台灣電力股份有限公司","553南投縣水里鄉車埕村民權巷125號","陳俊助","(049)2776605分機373","選擇性招標(建立合格廠商名單後續邀標)","財物類","最低標","81459000","大同股份有限公司","104臺北市中山區集英里21鄰中山北路3段22號",""
"award_20200401.xml","2020/04/01","2020/04/15","2020/04/09","2020/04/13","IG108053","關務署暨所屬各關公文線上簽核系統升級建置（含系統硬體設備維護）採購案","財政部關務署","103臺北市大同區塔城街13號","事務科-賴欣怡","(02)25505500分機1326","限制性招標(經公開評選或公開徵求)","勞務類","準用最有利標","11908000","英福達科技股份有限公司","100臺北市中正區衡陽路10號7樓",""
"award_20200401.xml","2020/04/01","2020/04/15","2020/04/09","2020/04/10","1082W059","延性鑄鐵管K型第三種100m/m、 200m/m等乙批","台灣自來水股份有限公司第四區管理處","404臺中市北區雙十路二段二號","楊淑菁","(04)22218341分機325","公開招標","財物類","最低標","50648850","錦源鑄造工業股份有限公司","104臺北市中山區建國北路1段69號9樓",""
"award_20200401.xml","2020/04/01","2020/04/15","2020/04/09","2020/04/10","109088","109年度第一分區管理中心及其他抽水站自動化監控系統維護案","臺北市政府工務局水利工程處","110臺北市信義區市府路1號7樓（西南區）","林宏田","(02)27208889分機2619","限制性招標(經公開評選或公開徵求)","勞務類","準用最有利標","4490000","健格科技股份有限公司","114臺北市內湖區民權東路6段21巷33、35號3樓",""
"award_20200401.xml","2020/04/01","2020/04/15","2020/04/09","2020/04/10","NCHC-S-109006","三地大樓基礎設施委外駐地操作保養測試維護","財團法人國家實驗研究院高速網路與計算中心","744臺南市新市區南科三路28號","蔡美娟","(06)5050940分機752","限制性招標(經公開評選或公開徵求)","勞務類","準用最有利標","9357000","正興機電工程股份有限公司","235新北市中和區中正路801號3樓",""
"award_20200401.xml","2020/04/01","2020/04/15","2020/04/09","2020/04/13","1090122S0044","109年度宣傳短片電視託播案","臺北市政府","110臺北市信義區巿府路一號3樓南區","廖函詩","(02)27208889分機1128","限制性招標(經公開評選或公開徵求)","勞務類","準用最有利標","8392600","東森電視事業股份有限公司","100臺北市中正區忠孝西路1段4號12樓","臺灣電視事業股份有限公司"
"award_20200401.xml","2020/04/01","2020/04/15","2020/04/09","2020/04/16","109A165","109年度環保集點制度推動專案工作計畫","行政院環境保護署","100臺北市中正區中華路一段83號","王瑞鋐;江家慧","(02)23117722分機2921;2455","限制性招標(經公開評選或公開徵求)","勞務類","準用最有利標","17000000","汎宇電商股份有限公司","115臺北市南港區南港路3段50巷7號4樓",""
"award_20200401.xml","2020/04/01","2020/04/15","2020/04/09","2020/04/10","10807002040101305","萬芳、景美及奇岩抽水站機組更新暨埤腹等3座抽水站周邊設備更新工程","臺北市政府工務局水利工程處","110臺北市信義區市府路1號7樓（西南區）","姚文美","(02)27208889分機2672","公開招標","工程類","最有利標","235400000","山豐營造股份有限公司","115臺北市南港區三重路19之5號2樓",""
"award_20200401.xml","2020/04/01","2020/04/15","2020/04/09","2020/04/16","10918T","109年度整體農業政策整合行銷案","行政院農業委員會","100臺北市中正區南海路37號","楊晏婷","(02)23126065分機","限制性招標(經公開評選或公開徵求)","勞務類","準用最有利標","16550000","民視文化事業股份有限公司","244新北市林口區信義路99號7樓","年代網際事業股份有限公司"
"award_20200401.xml","2020/04/01","2020/04/15","2020/04/09","2020/04/28","PA1901147","伺服器及儲存設備擴充汰換1式","國立臺灣大學醫學院附設醫院","100臺北市中正區中山南路7號","陳玉霞","(02)23562043分機","公開招標","財物類","最低標","42000000","凌群電腦股份有限公司","108臺北市萬華區峨眉街115號6樓",""
