"SourceFile","RangeStartDate","RangeEndDate","AwardDate","AwardNoticeDate","TenderCaseNo","TenderName","TenderOrgName","TenderOrgAddr","ContactPerson","TenderTel","ProcurementType","ProcurementAttr","TenderAwardWay","TenderAwardPrice","BidderSuppName","BidderSuppAddr","NotObtainSuppName"
"award_20201101.xml","2020/11/01","2020/11/15","2020/11/09","2020/11/11","1090088929","台9線花東縱谷公路安全景觀大道計畫（臺東段）施工前、中暨營運階段之環境監測委託服務工作","交通部公路總局第三區養護工程處","920屏東縣潮州鎮光復路259號","工務科 楊淵竣","(08)7893456分機1107","限制性招標(經公開評選或公開徵求)","勞務類","準用最有利標","75916764","華光工程顧問股份有限公司","114臺北市內湖區陽光街383號2樓","艾奕康工程顧問股份有限公司"
"award_20201101.xml","2020/11/01","2020/11/15","2020/11/09","2020/11/11","5460900157","資料擷取系統(配電管理與圖資整合系統)1套","台灣電力股份有限公司綜合研究所","100臺北市中正區羅斯福路4段198號","鄭文彥","(02)23601355分機","公開招標","財物類","最低標","17167841","禾新電訊股份有限公司","116臺北市文山區羅斯福路5段150巷12號1樓","極簡科技股份有限公司"
"award_20201101.xml","2020/11/01","2020/11/15","2020/11/09","2020/11/11","I7309D028","109年燒鹼溶液長約","台灣中油股份有限公司","110臺北市信義區松仁路3號19樓","簡光廷","(02)87258334分機","公開招標","財物類","最低標","122304000","臺灣塑膠工業股份有限公司麥寮分公司","638雲林縣麥寮鄉中興村10鄰台塑工業園區1號之1","百飛企業有限公司"
"award_20201101.xml","2020/11/01","2020/11/15","2020/11/09","2020/11/11","109010589","資源再生中心擴建統包工程委託專案管理(含監造)技術服務案","科技部南部科學園區管理局","744臺南市新市區南科三路二十二號","陳榮耀","(06)5051001分機2556","限制性招標(經公開評選或公開徵求)","勞務類","準用最有利標","74857500","中興工程顧問股份有限公司","105臺北市松山區南京東路5段171號14樓",""
"award_20201101.xml","2020/11/01","2020/11/15","2020/11/09","2020/11/13","110e700012","后里園區景觀及清潔維護工作(110~111年度)","科技部中部科學園區管理局","407臺中市西屯區中科路2號","熊婉贏(規範)/陳家榮(招標)","(04)25658588分機7633/6925","限制性招標(經公開評選或公開徵求)","勞務類","準用最有利標","30110000","欣欣環保工程股份有限公司","403臺中市西區三民西路184號1樓","欣樺股份有限公司"
"award_20201101.xml","2020/11/01","2020/11/15","2020/11/09","2020/11/13","110f500012","臺中園區(含擴建用地)環境監測計畫（110-112年度）","科技部中部科學園區管理局","407臺中市西屯區中科路2號","盧德笙(規範)/陳家榮(招標)","(04)25658588分機79376925","限制性招標(經公開評選或公開徵求)","勞務類","準用最有利標","48255000","艾奕康工程顧問股份有限公司","110臺北市信義區信義路5段8號16樓",""
"award_20201101.xml","2020/11/01","2020/11/15","2020/11/09","2020/11/13","109f500132","二林園區環境監測計畫（110-112年度）","科技部中部科學園區管理局","407臺中市西屯區中科路2號","李文智(規範)/陳家榮(招標)","(04)25658588分機7933/6925","限制性招標(經公開評選或公開徵求)","勞務類","準用最有利標","59565000","環興科技股份有限公司","105臺北市松山區南京東路5段171號12樓",""
"award_20201101.xml","2020/11/01","2020/11/15","2020/11/09","2020/11/20","109A296","污染通量評估技術建置與場址應用計畫","行政院環境保護署","100臺北市中正區中華路一段83號","洪豪駿;劉美玲","(02)23832389分機8313;2468","限制性招標(經公開評選或公開徵求)","勞務類","準用最有利標","16300000","美商傑明工程顧問股份有限公司台灣分公司","105臺北市松山區敦化北路167號9樓",""
"award_20201101.xml","2020/11/01","2020/11/15","2020/11/09","2020/11/12","09BY04","Wood Mackenzie資產評估資料庫使用權一年","台灣中油股份有限公司探採事業部","360苗栗縣苗栗市中正路140號 1F","阮郁奇","(037)262100分機385","限制性招標(未經公開評選或公開徵求)","財物類","最低標","25942000","Wood Mackenzie Asia Pacific Pte Ltd","9993 Church Street, #29-01, Samsung Hub, Singapore, 049483",""
"award_20201101.xml","2020/11/01","2020/11/15","2020/11/09","2020/11/17","09BY03","IHS探勘資料庫使用權一年","台灣中油股份有限公司探採事業部","360苗栗縣苗栗市中正路140號 1F","阮郁奇","(037)262100分機385","限制性招標(未經公開評選或公開徵求)","財物類","最低標","30825630","IHS Global Pte. Ltd.","9998 Marina View, Asia Square T1#12-01, Singapore",""
"award_20201101.xml","2020/11/01","2020/11/15","2020/11/09","2020/11/27","109BZ028","「鐵道橋梁智慧監管統計系統建置」委託技術服務","交通部鐵道局","220新北市板橋區縣民大道2段7號9樓","彭懋森","(02)80723333分機4704","限制性招標(經公開評選或公開徵求)","勞務類","準用最有利標","7000000","中興工程顧問股份有限公司","105臺北市松山區南京東路5段171號14樓",""
"award_20201101.xml","2020/11/01","2020/11/15","2020/11/10","2020/11/11","109B14","110年度農科園區環境監督許可審查及總量管制計畫","行政院農業委員會屏東農業生物技術園區籌備處","908屏東縣長治鄉德和村神農路1號","張鈺欣","(08)7741051分機","限制性招標(經公開評選或公開徵求)","勞務類","準用最有利標","5500000","元科科技股份有限公司","802高雄市苓雅區中正一路120號15樓之1",""
"award_20201101.xml","2020/11/01","2020/11/15","2020/11/10","2020/11/11","B109358","北部地區機動海巡隊新北艦109年度歲修案","海洋委員會海巡署艦隊分署","251新北市淡水區中正路一段63巷20號","蔡孟融","(02)28053990分機362416","公開招標","財物類","最低標","16620000","潤誠船舶工程有限公司","202基隆市中正區和一路41巷2弄23號1樓","海澄企業有限公司"
"award_20201101.xml","2020/11/01","2020/11/15","2020/11/10","2020/11/11","3520900168","110/111年輻射管制區廠房及機具之清潔除污工作","台灣電力股份有限公司第三核能發電廠","946屏東縣恆春鎮南灣路387號","林昱豪","(08)8893470分機3047","公開招標","勞務類","最低標","17535000","世盛消防設備檢修有限公司","800高雄市新興區南台路116號1樓","福興工程行(獨資)"
"award_20201101.xml","2020/11/01","2020/11/15","2020/11/10","2020/11/11","D10923G","藥品","國立成功大學醫學院附設醫院","704臺南市北區勝利路138號 資材室 採購組","王秀文","(06)2353535分機2809","選擇性招標(個案)","財物類","最低標","17943600","台灣東洋藥品工業股份有限公司","115臺北市南港區園區街3-1號3樓","宏曜藥業股份有限公司"
"award_20201101.xml","2020/11/01","2020/11/15","2020/11/10","2020/11/13","IG109035","中央空調設備等檢查維護保養及操作服務採購案","財政部關務署","103臺北市大同區塔城街13號","事務科-林承義","(02)25505500分機1331","公開招標","勞務類","最低標","2840000","普泉工程股份有限公司","220新北市板橋區縣民大道3段133巷23號1樓",""
"award_20201101.xml","2020/11/01","2020/11/15","2020/11/10","2020/11/13","109LM0175X","TEMU2000型用車內顯示器(SI)等15項","交通部臺灣鐵路管理局","100臺北市中正區北平西路3號5樓","謝馨儀","(02)23815226分機2388","限制性招標(未經公開評選或公開徵求)","財物類","最低標","56100000","翔贊資通訊有限公司","221新北市汐止區新台五路1段79號17樓之6",""
"award_20201101.xml","2020/11/01","2020/11/15","2020/11/10","2020/11/13","1090911S0141","109年臺北市政府教育局資訊設備維運、入口網站及教育信箱維護案","臺北市政府","110臺北市信義區110臺北市信義區巿府路一號3樓南區","陳瑞祥","(02)27208889分機1135","限制性招標(經公開評選或公開徵求)","勞務類","準用最有利標","11085000","大同股份有限公司","104臺北市中山區集英里21鄰中山北路3段22號","宏碁雲架構服務股份有限公司"
"award_20201101.xml","2020/11/01","2020/11/15","2020/11/10","2020/11/13","1090105266","大武工務段轄區110年度綠美化維護工作","交通部公路總局第三區養護工程處","920屏東縣潮州鎮光復路259號","養護科   林澤威","(08)7893456分機1210","公開招標","勞務類","最低標","5660000","人宇企業社(合夥)","950臺東縣臺東市民生里寧波街二十一巷三十三號一樓","冠景企業社(獨資)"
"award_20201101.xml","2020/11/01","2020/11/15","2020/11/10","2020/11/12","L0209P1101S","110年旅客運送責任保險","交通部臺灣鐵路管理局","100臺北市中正區北平西路3號5樓","履約:運務處廖先生/招標:材料處李先生（餘詳附加說明）","(02)23815226分機3129/4903","公開招標","勞務類","最低標","43237010","國泰世紀產物保險股份有限公司","106臺北市大安區仁愛路4段296號1樓","兆豐產物保險股份有限公司"
"award_20201101.xml","2020/11/01","2020/11/15","2020/11/10","2020/11/12","0240900014","電費核算開票系統軟硬體升級及功能擴充","台灣電力股份有限公司","100臺北市中正區羅斯福路3段242號4樓","洪明雪","(02)23666994分機","限制性招標(經公開評選或公開徵求)","勞務類","準用最有利標","649008379","三商電腦股份有限公司","110臺北市信義區信義路5段150巷2號4樓之3",""
"award_20201101.xml","2020/11/01","2020/11/15","2020/11/10","2020/11/17","10955","「2021臺北國際烘焙暨設備展-米糧烘焙精品館」暨整合行銷計畫","行政院農業委員會農糧署","100臺北市中正區杭州南路一段15號","高庭芳(採購單位)/廖婉均(請購單位)","(02)23937231分機111/586","限制性招標(經公開評選或公開徵求)","勞務類","準用最有利標","5670000","愷奕國際展覽設計有限公司","105臺北市松山區南京東路3段287號2樓",""
"award_20201101.xml","2020/11/01","2020/11/15","2020/11/10","2020/11/24","LP5-109050","車輛（汽車、機車）保險","臺灣銀行股份有限公司","100臺北市中正區武昌街一段45號","開標二科賴小姐","(02)23493456分機7674","公開招標","勞務類","最低標","417600000","華南產物保險股份有限公司","110臺北市信義區忠孝東路四段560號5樓",""
"award_20201101.xml","2020/11/01","2020/11/15","2020/11/10","2020/11/12","D109-N138","藥品","國立成功大學醫學院附設醫院","704臺南市北區勝利路138號","吳雅萍","(06)2353535分機4534","選擇性招標(個案)","財物類","最低標","15268600","裕利股份有限公司","105臺北市松山區南京東路4段126號10樓、10樓之1至之3",""
"award_20201101.xml","2020/11/01","2020/11/15","2020/11/10","2020/11/12","D109-N139","藥品","國立成功大學醫學院附設醫院","704臺南市北區勝利路138號","吳雅萍","(06)2353535分機4534","選擇性招標(個案)","財物類","最低標","1366000","晟揚生物科技有限公司","414臺中市烏日區仁德里中山路一段527號13樓之2","吉發企業股份有限公司"
"award_20201101.xml","2020/11/01","2020/11/15","2020/11/10","2020/12/03","0080900114","壓接套管、跳線套管及H型壓接套管等乙批","台灣電力股份有限公司","100臺北市中正區羅斯福路3段242號8樓","張閤軒","(02)23666773分機","選擇性招標(建立合格廠商名單後續邀標)","財物類","最低標","14675220","建寅企業股份有限公司","717臺南市仁德區保安路一段19巷1號","豐田電機股份有限公司"
"award_20201101.xml","2020/11/01","2020/11/15","2020/11/10","2020/11/11","HC-109-0732","高通量核酸萃取儀4台","行政院農業委員會家畜衛生試驗所","251新北市淡水區中正路376號","豬瘟研究組潘先生312、303；(事務)曾小姐111","(02)26212111分機312、303","公開招標","財物類","最低標","5500000","京磊股份有限公司","235新北市中和區中正路800號6樓之5",""
"award_20201101.xml","2020/11/01","2020/11/15","2020/11/10","2020/11/11","5460900131","「加壓設備」檢修1式","台灣電力股份有限公司綜合研究所","100臺北市中正區羅斯福路4段198號","符績輝","(02)23601363分機","公開招標","勞務類","最低標","16227750","士林電機廠股份有限公司台北分公司","104臺北市中山區長安東路1段9號3樓","意相有限公司"
"award_20201101.xml","2020/11/01","2020/11/15","2020/11/11","2020/11/19","1090092501","關山工務段轄區110年度省道預約暗溝排水設施疏濬工作","交通部公路總局第三區養護工程處","920屏東縣潮州鎮光復路259號","養護科 薛星園","(08)7893456分機1224","公開招標","勞務類","最低標","4499999","申邦環保實業有限公司","220新北市板橋區漢生西路153巷9之1號",""
"award_20201101.xml","2020/11/01","2020/11/15","2020/11/10","2020/11/11","109LM0096P","電聯車用蓄電池排列(DC110V)等4項","交通部臺灣鐵路管理局","100臺北市中正區北平西路3號5樓","陳明正","(02)23815226分機3703","公開招標","財物類","最低標","33445335","聯捷電通有限公司","408臺中市南屯區永春東路250號5樓","輔全企業有限公司"
"award_20201101.xml","2020/11/01","2020/11/15","2020/11/11","2020/11/19","109S-004","110年度簡易行政業務勞務承攬案","內政部營建署","105臺北市松山區八德路二段342號","張世宏","(02)87712525分機","限制性招標(經公開評選或公開徵求)","勞務類","準用最有利標","15883000","優利國際資源整合有限公司","110臺北市信義區基隆路1段143號13樓","勤言企業有限公司"
"award_20201101.xml","2020/11/01","2020/11/15","2020/11/11","2020/11/19","109-2-00158","「106~109年桃園國際機場助導航燈光系統維護契約」第1次契約變更案","桃園國際機場股份有限公司","337桃園市大園區航站南路9號","嚴小姐","(03)2733663分機","限制性招標(未經公開評選或公開徵求)","勞務類","最低標","14555079","比利時商艾迪比有限公司台灣分公司","337桃園市大園區三民路2段589號2樓",""
"award_20201101.xml","2020/11/01","2020/11/15","2020/11/11","2020/11/16","108-D0602","高雄海洋科技產業創新專區海洋科技工程人才培訓及認證中心海上求生訓練設備採購案","財團法人金屬工業研究發展中心","811高雄市楠梓區高楠公路1001號","採購：黃小姐#2858/承辦：謝先生#3206","(07)3513121分機3206","公開招標","財物類","最有利標","26948233","康樺科技工程顧問股份有限公司","830高雄市鳳山區凱旋路86之8號","台灣柏堅貨櫃維修股份有限公司"
"award_20201101.xml","2020/11/01","2020/11/15","2020/11/11","2020/12/09","PA2000299","中央生理監視器系統一批","國立臺灣大學醫學院附設醫院","100臺北市中正區中山南路7號","朱庭誼","(02)23562038分機","公開招標","財物類","最低標","17980000","生訊科技股份有限公司","114臺北市內湖區新湖一路145號5樓","福智美科技股份有限公司"
"award_20201101.xml","2020/11/01","2020/11/15","2020/11/11","2020/11/16","109A-071","110年度建築工程組勞務承攬案","內政部營建署","105臺北市松山區八德路二段342號","吳岳脩/莊慧如87712789","(02)87712529分機","公開招標","勞務類","最低標","9684700","勤言企業有限公司","220新北市板橋區莒光路114巷4號1樓","鴻集實業股份有限公司"
"award_20201101.xml","2020/11/01","2020/11/15","2020/11/11","2020/11/16","FB20074943","110年東址變壓器汰換案","國立臺灣大學醫學院附設醫院","100臺北市中正區中山南路7號","張嘉齡","(02)23123456分機61322","公開招標","財物類","最低標","17900000","宏于電機有限公司","238新北市樹林區武林街2之3號","智景有限公司"
"award_20201101.xml","2020/11/01","2020/11/15","2020/11/11","2020/11/16","TD-BA1091028","臺東、綠島、蘭嶼航空站110年清潔勞務委外","交通部民用航空局臺東航空站","950臺東縣臺東市民航路1100號","林加富","(089)362511分機","公開招標","勞務類","最低標","8457889","台灣旗聖國際有限公司","710臺南市永康區復華里復國二路２１５巷３８號十一樓之３","柚良環衛科技社"
"award_20201101.xml","2020/11/01","2020/11/15","2020/11/11","2020/11/23","YM090210","關節內注射劑等醫材，單價合約","國立臺灣大學醫學院附設醫院雲林分院","640雲林縣斗六市雲林路二段579號","林枝香","(05)5323911分機2227","選擇性招標(個案)","財物類","最低標","27795000","瑞中亞醫療器材有限公司","505彰化縣鹿港鎮頂厝里鹿東路359號1樓",""
"award_20201101.xml","2020/11/01","2020/11/15","2020/11/11","2020/11/17","0240900015","大數據及資料共享平台建置","台灣電力股份有限公司","100臺北市中正區羅斯福路3段242號4樓","洪明雪","(02)23666994分機","限制性招標(經公開評選或公開徵求)","勞務類","準用最有利標","76125000","盟立自動化股份有限公司台北分公司","106臺北市大安區敦化南路二段97號26樓","宏碁資訊服務股份有限公司"
"award_20201101.xml","2020/11/01","2020/11/15","2020/11/11","2020/11/12","109TA-AA-7","110~111年度邊坡調查監測作業及路線改善規劃","行政院農業委員會林務局阿里山林業鐵路及文化資產管理處","60001嘉義市東區文化路308號","鐵路維護科連祥益","(05)2779843分機166","限制性招標(經公開評選或公開徵求)","勞務類","準用最有利標","17000000","兆豐工程技術顧問股份有限公司","30001新竹市東區公園里光復路2段481號7樓之1",""
"award_20201101.xml","2020/11/01","2020/11/15","2020/11/11","2020/11/12","UM091000","總分院及癌醫中心醫院手術室醫材2項單價合約招標案","國立臺灣大學醫學院附設醫院","100臺北市中正區中山南路7號","黃怡甄","(02)23562050分機","選擇性招標(個案)","財物類","最低標","28035750","安美得生醫股份有限公司","248新北市五股區五權七路14號之1","普旌股份有限公司"
"award_20201101.xml","2020/11/01","2020/11/15","2020/11/11","2020/11/12","3710900316","避雷器一批3項","台灣電力股份有限公司台中發電廠","434臺中市龍井區麗水里龍昌路1號","劉東翰","(04)26302123分機2631","公開招標","財物類","最低標","18669000","中興電工機械股份有限公司","235新北市中和區中正路801號3樓",""
"award_20201101.xml","2020/11/01","2020/11/15","2020/11/11","2020/11/17","109B-R22","光度量測化學分析儀試劑五年期單價開口契約（含提供儀器設備、耗材及維修）","臺中榮民總醫院","407臺中市西屯區臺灣大道四段1650號","羅先生","(04)23592525分機2817","公開招標","財物類","最低標","16038000","世藝生醫股份有限公司","403臺中市西區民龍里館前路55號2樓之3",""
"award_20201101.xml","2020/11/01","2020/11/15","2020/11/11","2020/12/01","UM090880","總分院及癌醫中心醫院手術室醫材2項單價合約招標案","國立臺灣大學醫學院附設醫院","100臺北市中正區中山南路7號","黃怡甄","(02)23562050分機","選擇性招標(個案)","財物類","最低標","28375700","巨鉦科技股份有限公司","111臺北市士林區至誠路2段22號1樓",""
"award_20201101.xml","2020/11/01","2020/11/15","2020/11/11","2020/11/17","LP5-109023","電腦設備用品(商用電腦)","臺灣銀行股份有限公司","100臺北市中正區武昌街一段45號","開標二科余先生","(02)23493456分機7675","公開招標","財物類","最低標","5542290000","捷雷科技股份有限公司","632雲林縣虎尾鎮西安里林森路二段157號1樓","綜益資訊股份有限公司"
"award_20201101.xml","2020/11/01","2020/11/15","2020/11/11","2020/11/26","109-08017","110年度員林段台63線路容清理及清掃工作","交通部公路總局第二區養護工程處","403臺中市西區大全街127號","辜柏榮","(04)23715030分機331","公開招標","勞務類","最低標","7870000","春億企業社(獨資)","542南投縣草屯鎮新豐里日新街238號","金蘭園藝有限公司"
"award_20201101.xml","2020/11/01","2020/11/15","2020/11/12","2020/11/16","109589W","脊椎椎間穩定系統等三項兩年開口契約","臺北榮民總醫院","112臺北市北投區石牌路2段201號","吳蘊華","(02)28757792分機","公開招標","財物類","最低標","34203720","立捷生醫科技有限公司","100臺北市中正區和平西路1段100號14樓之3",""
"award_20201101.xml","2020/11/01","2020/11/15","2020/11/12","2020/11/13","109434F","消毒藥水等6項兩年單價開口契約","臺北榮民總醫院","112臺北市北投區石牌路2段201號","王玫淳","(02)28757245分機","公開招標","財物類","最低標","23686133","台灣費森尤斯醫藥股份有限公司","114臺北市內湖區瑞湖街58號7樓","百特醫療產品股份有限公司"
"award_20201101.xml","2020/11/01","2020/11/15","2020/11/12","2020/11/13","1090921-2","109-110年度高雄市農村再生及水土保持工程(一)委託設計監造技術服務","行政院農業委員會水土保持局臺南分局","701臺南市東區林森路一段316號","施賢聰","(06)2684367分機4307","限制性招標(經公開評選或公開徵求)","勞務類","準用最有利標","12540000","剴盛工程顧問有限公司","807高雄市三民區孝順街355號1-2樓","宇真工程顧問有限公司"
"award_20201101.xml","2020/11/01","2020/11/15","2020/11/12","2020/11/13","U8D09R096","SPARE PARTS FOR HERMETIC PUMP一批","台灣中油股份有限公司","811高雄市楠梓區左楠路2號","林妤真","(07)5824141分機2802","限制性招標(未經公開評選或公開徵求)","財物類","最低標","16231192","三璉有限公司","811高雄市楠梓區聖雲街127巷2號",""
"award_20201101.xml","2020/11/01","2020/11/15","2020/11/12","2020/11/13","1090602C0112","「民生水資源再生中心暨下水道環境教育館新建工程」統包案","臺北市政府","110臺北市信義區市府路1號3樓南區","徐采薇","(02)27208889分機1136","公開招標","工程類","最有利標","2111000000","富台工程股份有限公司","115臺北市南港區三重路19之5號6樓",""
"award_20201101.xml","2020/11/01","2020/11/15","2020/11/12","2020/11/16","109611W","電池式傷口沖洗器等六項兩年開口契約","臺北榮民總醫院","112臺北市北投區石牌路2段201號","吳蘊華","(02)28757792分機","公開招標","財物類","最低標","44945469","互裕股份有限公司","104臺北市中山區敬業一路192號4樓",""
"award_20201101.xml","2020/11/01","2020/11/15","2020/11/12","2020/11/13","109587J","產包等3項二年單價開口契約","臺北榮民總醫院","112臺北市北投區石牌路2段201號","范碧珠","(02)28757250分機","公開招標","財物類","最低標","20796000","雅力信股份有限公司","110臺北市信義區基隆路2段109號5樓",""
"award_20201101.xml","2020/11/01","2020/11/15","2020/11/12","2020/11/13","109-4-1221","連線電腦病毒防治系統軟體更新授權","中華郵政股份有限公司","106臺北市大安區金山南路2段55號","李麗萍","(02)23214311分機2305","限制性招標(未經公開評選或公開徵求)","財物類","最低標","16700000","宏碁資訊服務股份有限公司","106臺北市大安區信義路4段6號9樓",""
"award_20201101.xml","2020/11/01","2020/11/15","2020/11/12","2020/11/16","I8N09T006","浮筒用之錨鍊及卸克一批","台灣中油股份有限公司","110臺北市信義區松仁路3號19樓","黃詠辰","(02)87258316分機","公開招標","財物類","最低標","10227000","奕恩有限公司","813高雄市左營區菜公里重義路59號15樓",""
"award_20201101.xml","2020/11/01","2020/11/15","2020/11/12","2020/11/20","A3E200651","高雄港第七貨櫃中心計畫-S4~S5櫃場建築物機電工程","臺灣港務股份有限公司高雄港務分公司","804高雄市鼓山區蓬萊二路1號","黃士益","(07)5622341分機","公開招標","工程類","最低標","256000000","昇民企業有限公司","807高雄市三民區黃興路113號12樓之3","寶大水電工程有限公司"
"award_20201101.xml","2020/11/01","2020/11/15","2020/11/12","2020/11/24","0611L1090923","台糖公司110年度產物保險","台灣糖業股份有限公司","701臺南市東區生產路68號","鄭博文","(06)3378848分機","公開招標","勞務類","最低標","15251275","新光產物保險股份有限公司","104臺北市中山區建國北路2段13號11樓",""
"award_20201101.xml","2020/11/01","2020/11/15","2020/11/12","2020/11/17","109090193","新化工務段110年台19甲線、台20線路容維護（割草等）","交通部公路總局第五區養護工程處","60001嘉義市東區安和街209號","產管科-林相誼,養護科-莊靜綺","(05)2782861分機1201,2523","公開招標","勞務類","最低標","4285000","辛邦企業社(獨資)","715臺南市楠西區楠西里民族路53巷4號1樓","再興園藝有限公司"
"award_20201101.xml","2020/11/01","2020/11/15","2020/11/12","2020/11/17","ndc109070","110年度中興新村環境清潔及維護勞務採購案","國家發展委員會","100臺北市中正區寶慶路3號","陳美利","(02)23165300分機1745","限制性招標(經公開評選或公開徵求)","勞務類","準用最有利標","18100000","毅潔環保有限公司","104臺北市中山區南京東路1段25號10樓之2","新翔環保事業有限公司"
