"SourceFile","RangeStartDate","RangeEndDate","AwardDate","AwardNoticeDate","TenderCaseNo","TenderName","TenderOrgName","TenderOrgAddr","ContactPerson","TenderTel","ProcurementType","ProcurementAttr","TenderAwardWay","TenderAwardPrice","BidderSuppName","BidderSuppAddr","NotObtainSuppName"
"award_20200101.xml","2020/01/01","2020/01/15","2020/01/02","2020/01/03","3710800404","109年度中1機FGD風門設備大修工作","台灣電力股份有限公司台中發電廠","434臺中市龍井區麗水里龍昌路1號","廖雪涵","(04)26302123分機2612","公開招標","勞務類","最低標","15435006","彥富實業有限公司","436臺中市清水區國姓里三美路120號",""
"award_20200101.xml","2020/01/01","2020/01/15","2020/01/02","2020/01/03","108L0322","冷凍豬肉一批開口契約","臺北榮民總醫院","112臺北市北投區石牌路二段201號","陳仙恩","(02)28757472分機","公開招標","財物類","最低標","19990280","嘉一香食品股份有限公司","108臺北市萬華區桂林路128號21樓",""
"award_20200101.xml","2020/01/01","2020/01/15","2020/01/02","2020/01/21","GEO1097002","109年度坡地管理資料庫擴充及維護委託資訊服務案","臺北市政府工務局大地工程處","110臺北市信義區松德路300號3樓","黃凱暉","(02)27593001分機3726","限制性招標(經公開評選或公開徵求)","勞務類","準用最有利標","4990000","多維空間資訊有限公司","114臺北市內湖區石潭路27號7樓之6",""
"award_20200101.xml","2020/01/01","2020/01/15","2020/01/02","2020/01/20","108102911","電子票證IC卡(訂製卡)","交通部觀光局","106臺北市大安區忠孝東路4段290號9樓","陳瀅如","(02)23491500分機8413","公開招標","財物類","最低標","8600000","悠遊卡股份有限公司","115臺北市南港區園區街3-1號6樓之2、13樓及13樓之1","愛金卡股份有限公司"
"award_20200101.xml","2020/01/01","2020/01/15","2020/01/02","2020/01/06","30610810","109年度新營工業區污水處理廠污泥委託代清理工作","經濟部工業局","730臺南市新營區新工路28號","林詠瑄","(06)6526838分機6132","公開招標","勞務類","最低標","4896500","大登環保科技股份有限公司","830高雄市鳳山區光復路二段339之5號2樓","永潔資源有限公司"
"award_20200101.xml","2020/01/01","2020/01/15","2020/01/02","2020/01/08","108-D0801","高雄海洋科技產業創新專區海洋科技產業創新研發中心深水池造流設備採購案","財團法人金屬工業研究發展中心","811高雄市楠梓區高楠公路1001號","採購：黃小姐 #2858 /承辦：陳先生 #2643","(07)3513121分機2858","公開招標","財物類","最有利標","99423844","三太造機廠股份有限公司","621嘉義縣民雄鄉嘉義縣民雄鄉福樂村成功三街3號",""
"award_20200101.xml","2020/01/01","2020/01/15","2020/01/02","2020/01/06","U8F08F010","No.27鍋爐脫硝觸媒更新(含安裝、測試等)一批","台灣中油股份有限公司","110臺北市信義區松仁路3號19樓","黃詠辰","(02)87258316分機","公開招標","財物類","最低標","14681625","國偉科技有限公司","813高雄市左營區博愛三路8號16樓之2","輝虎工業股份有限公司"
"award_20200101.xml","2020/01/01","2020/01/15","2020/01/02","2020/01/07","RDB0816022","深澳中心三號及四號卸油臂整修工作","台灣中油股份有限公司","110臺北市信義區松仁路3號19樓","祝安萱","(02)87258306分機","限制性招標(未經公開評選或公開徵求)","勞務類","最低標","21283370","育青企業有限公司","114臺北市內湖區民權東路6段160號7樓之2",""
"award_20200101.xml","2020/01/01","2020/01/15","2020/01/02","2020/01/06","1082319E","109年度資料浮標維護與資料管理作業暨東北角海域安全資訊管理作業","交通部中央氣象局","100臺北市中正區公園路64號","麥先生","(02)23491198分機","限制性招標(未經公開評選或公開徵求)","勞務類","最低標","12460000","財團法人成大研究發展基金會","701臺南市東區大學路1號",""
"award_20200101.xml","2020/01/01","2020/01/15","2020/01/02","2020/01/03","NPM108199","璀璨任務：尋找新感動 高解析度影片製作宣傳案","國立故宮博物院","111臺北市士林區至善路二段221號","教展處吳先生/秘書室李小姐","(02)66103600分機2150/2283","限制性招標(經公開評選或公開徵求)","勞務類","準用最有利標","9500000","青銅視覺藝術有限公司","220新北市板橋區縣民大道3段109號4樓",""
"award_20200101.xml","2020/01/01","2020/01/15","2020/01/02","2020/01/03","109KSPTDS01","109年度高雄市及屏東縣水土保持、農村及農路工程委託設計監造技術服務","行政院農業委員會水土保持局臺南分局","701臺南市東區林森路一段316號","鍾世文","(06)2684367分機4118","限制性招標(經公開評選或公開徵求)","勞務類","準用最有利標","17766000","昱城工程顧問有限公司","954臺東縣卑南鄉泰安村泰安320號1樓","睿泰工程顧問有限公司"
"award_20200101.xml","2020/01/01","2020/01/15","2020/01/02","2020/01/06","DEF0800014","VEGA5000S桌上型刷卡機設備維護保養","台灣中油股份有限公司","110臺北市信義區松仁路3號19樓","祝安萱","(02)87258306分機","限制性招標(未經公開評選或公開徵求)","勞務類","最低標","19785500","嘉利科技股份有限公司","100臺北市中正區重慶南路2段51號13樓",""
"award_20200101.xml","2020/01/01","2020/01/15","2020/01/02","2020/01/06","APS1081107","109年度桌上型爆裂物偵檢儀6部增購案","內政部警政署航空警察局","337桃園市大園區埔心里航勤北路27號","鄭甲念","(03)3982231分機","公開招標","財物類","最低標","6240000","光智貿易有限公司","100臺北市中正區北平東路16號5樓之3","歐畢通科技有限公司"
"award_20200101.xml","2020/01/01","2020/01/15","2020/01/02","2020/01/06","109A043","國際廢棄物越境管理因應調整計畫","行政院環境保護署","100臺北市中正區中華路一段83號","黃相維   劉美玲","(02)23117722分機2634  2468","限制性招標(經公開評選或公開徵求)","勞務類","準用最有利標","7250000","環科工程顧問股份有限公司","106臺北市大安區忠孝東路4段280號8樓",""
"award_20200101.xml","2020/01/01","2020/01/15","2020/01/02","2020/01/07","109-4-1019","109年租賃支局網路設備","中華郵政股份有限公司","106臺北市大安區金山南路2段55號","王雪芬","(02)23921310分機2320","限制性招標(未經公開評選或公開徵求)","財物類","最低標","177971640","駿永資訊科技股份有限公司","100臺北市中正區北平東路30號5樓",""
"award_20200101.xml","2020/01/01","2020/01/15","2020/01/03","2020/01/21","10902W","109年度加強新媒體農業傳播計畫","行政院農業委員會","100臺北市中正區南海路37號","公關科江文德","(02)23126064分機","限制性招標(經公開評選或公開徵求)","勞務類","準用最有利標","8280000","海極創意代理股份有限公司","105臺北市松山區光復南路1號11樓之1","財團法人豐年社"
"award_20200101.xml","2020/01/01","2020/01/15","2020/01/03","2020/01/17","nwda1080140","工作站186臺","勞動部勞動力發展署北基宜花金馬分署","242新北市新莊區中平路439號南棟3樓","鄭煥琨/王瀅瀅","(02)89956399分機1253/1606","公開招標","財物類","最低標","9051600","炘承資訊有限公司","242新北市新莊區新樹路617號5樓",""
"award_20200101.xml","2020/01/01","2020/01/15","2020/01/03","2020/01/15","NO1090012","本所委託代辦109年員工公務出國機票及相關服務開口合約","行政院原子能委員會核能研究所","325桃園市龍潭區佳安里文化路1000號","賴佩青/申請人張貴英 分機 2326","(03)4711400分機2342","限制性招標(經公開評選或公開徵求)","勞務類","準用最有利標","6010500","天意旅行社股份有限公司","110臺北市信義區忠孝東路5段508號5樓之1","台灣英達旅行社有限公司"
"award_20200101.xml","2020/01/01","2020/01/15","2020/01/03","2020/01/07","1082W053","延性鑄鐵管K型第三種200m/m乙批","台灣自來水股份有限公司第四區管理處","404臺中市北區雙十路二段二號","楊淑菁","(04)22218341分機325","公開招標","財物類","最低標","47486250","友騰工業股份有限公司","221新北市汐止區長江街45號1樓","錦源鑄造工業股份有限公司"
"award_20200101.xml","2020/01/01","2020/01/15","2020/01/03","2020/01/06","MDC0850003","大林廠D-323油槽清洗檢修暨增設槽頂工作","台灣中油股份有限公司","110臺北市信義區松仁路3號19樓","曾明生","(02)87258319分機","公開招標","勞務類","最低標","29616195","全翰工業有限公司","335桃園市大溪區三元一街2巷35弄16號",""
"award_20200101.xml","2020/01/01","2020/01/15","2020/01/03","2020/01/08","GF2-108054","耐熱複合心鋁線(TACCSR) 636 、795MCM及附屬配件(購置及安裝)","臺灣銀行股份有限公司","100臺北市中正區武昌街一段45號","開標二科","(02)23497673分機","公開招標","財物類","最低標","152345256","Taihan Electric Wire Co., Ltd.","999Taihan Smart Tower,317 Sjimin-Daero, Dongan-Gu, Anyang-Si, Gyeonggi-Do,14055, S.Korea","LS Cable & System Ltd."
"award_20200101.xml","2020/01/01","2020/01/15","2020/01/03","2020/01/06","108-2-00109","桃園國際機場股份有限公司轉投資航空物流業可行性評估與規劃設立顧問案","桃園國際機場股份有限公司","337桃園市大園區航站南路9號","徐小姐","(03)2733699分機","限制性招標(經公開評選或公開徵求)","勞務類","準用最有利標","8190000","台灣野村總研諮詢顧問股份有限公司","105臺北市松山區敦化北路168號10樓","凌群策略財務顧問有限公司"
"award_20200101.xml","2020/01/01","2020/01/15","2020/01/03","2020/01/09","109e700042","二林園區景觀及清潔維護工作(109年度)","科技部中部科學工業園區管理局","407臺中市西屯區中科路2號","趙庭佑(規範)/陳家榮(招標)","(04)25658588分機7636/6925","限制性招標(經公開評選或公開徵求)","勞務類","準用最有利標","15300000","淼森工程有限公司","435臺中市梧棲區大村里28鄰立德街289巷11號1樓","一品景造園有限公司"
"award_20200101.xml","2020/01/01","2020/01/15","2020/01/03","2020/01/09","1081102-90","109年度訓練材料五金類集中採購","勞動部勞動力發展署高屏澎東分署","806高雄市前鎮區凱旋4路105號","陳信志","(07)8210171分機3112","公開招標","財物類","最低標","6185961","兆揚國際有限公司","833高雄市鳥松區松竹街35號1樓","元信機電工業股份有限公司"
"award_20200101.xml","2020/01/01","2020/01/15","2020/01/03","2020/01/06","10833197","三門診之UPS不斷電設備安裝","臺北榮民總醫院","112臺北市北投區石牌路2段201號","倪銘仁","(02)28712121分機7485","公開招標","財物類","最低標","24840000","群晶科技有限公司","242新北市新莊區思源路171號11樓",""
"award_20200101.xml","2020/01/01","2020/01/15","2020/01/03","2020/01/06","MGD0850004","大林廠煉製北區搭、拆架零星工作","台灣中油股份有限公司","811高雄市楠梓區左楠路2號","林德誠","(07)5824141分機2621","公開招標","勞務類","最低標","12300000","妙奕陞有限公司","825高雄市橋頭區三德路8之7號","祥宏企業有限公司"
"award_20200101.xml","2020/01/01","2020/01/15","2020/01/03","2020/01/06","3410800363-S08183","興三四機排煙脫硫設備年度經常性及大修檢修工作","台灣電力股份有限公司興達發電廠","828高雄市永安區鹽田里興達路六號","林瑞彬","(07)6912811分機3351","公開招標","勞務類","最低標","10920000","鈺發機械有限公司","827高雄市彌陀區漯底里樂安路100號",""
"award_20200101.xml","2020/01/01","2020/01/15","2020/01/03","2020/01/07","3520800185","移動式高壓注水泵3套","台灣電力股份有限公司第三核能發電廠","946屏東縣恆春鎮南灣路387號","羅時輝","(08)8893470分機3025","公開招標","財物類","最低標","40320000","鋐原能源股份有限公司","110臺北市信義區基隆路2段77號4樓之6","南寧工程股份有限公司"
"award_20200101.xml","2020/01/01","2020/01/15","2020/01/03","2020/01/07","109-4-1005","穿牆型四箱匣自動櫃員機設備319臺3年維護。","中華郵政股份有限公司","106臺北市大安區金山南路2段55號","蘇子洺","(02)23921310分機2316","公開招標","勞務類","最低標","15694800","錢隆科技股份有限公司","221新北市汐止區新台五路1段99號20樓之5",""
"award_20200101.xml","2020/01/01","2020/01/15","2020/01/03","2020/01/07","108A412","東亞與台灣空氣品質變異分析及衛星遙測資訊前瞻應用","行政院環境保護署","100臺北市中正區中華路一段83號","黃柏瑜 許惠琮","(02)23712121分機6108 2456","限制性招標(經公開評選或公開徵求)","勞務類","準用最有利標","8050000","國立中央大學","320桃園市中壢區中大路300號",""
"award_20200101.xml","2020/01/01","2020/01/15","2020/01/03","2020/01/09","W108030","109、110年度替代役役男制服、帽子開口契約採購案","內政部役政署","540南投縣南投市中興新村光明路21號","許碧燕","(049)2394908分機","公開招標","財物類","最低標","11487000","台長衣品有限公司","655雲林縣元長鄉長南村元中路10之1號",""
"award_20200101.xml","2020/01/01","2020/01/15","2020/01/03","2020/01/13","6930800049","蘆竹風力發電站#3~#5風機維修道路及電纜管排緊急搶修財物採購帶安裝","台灣電力股份有限公司再生能源處","435臺中市梧棲區頂寮里大智路2段332號","徐建智","(04)26580151分機3422","限制性招標(未經公開評選或公開徵求)","財物類","最低標","16794750","中興電工機械股份有限公司","235新北市中和區中正路801號3樓",""
"award_20200101.xml","2020/01/01","2020/01/15","2020/01/06","2020/01/15","109-A0207","109年度「能源服務平台與設備維護」","經濟部能源局","104臺北市中山區復興北路2號13樓","黃俊達","(02)27721370分機680","限制性招標(經公開評選或公開徵求)","勞務類","準用最有利標","10720000","宏碁資訊服務股份有限公司","106臺北市大安區信義路4段6號9樓",""
"award_20200101.xml","2020/01/01","2020/01/15","2020/01/06","2020/01/15","108-1-00032","臺灣桃園國際機場第三航站區土方及基礎工程第1次契約變更","桃園國際機場股份有限公司","337桃園市大園區航站南路9號","嚴小姐","(03)2733663分機","限制性招標(未經公開評選或公開徵求)","工程類","最低標","295000000","中華工程股份有限公司","105臺北市松山區新聚里東興路12號6樓",""
"award_20200101.xml","2020/01/01","2020/01/15","2020/01/06","2020/01/08","0080800087","161kV串聯電抗器","台灣電力股份有限公司","100臺北市中正區羅斯福路3段242號8樓","洪毓聆","(02)23666796分機","選擇性招標(建立合格廠商名單後續邀標)","財物類","最低標","118048350","士林電機廠股份有限公司","111臺北市士林區忠誠里19鄰中山北路6段88號16樓",""
"award_20200101.xml","2020/01/01","2020/01/15","2020/01/06","2020/01/07","108111401","108-110年度屏東縣水土保持工程委託設計監造(A)","行政院農業委員會水土保持局臺南分局","701臺南市東區台南市林森路一段316號","林妍琇","(06)2684367分機4203","限制性招標(經公開評選或公開徵求)","勞務類","準用最有利標","15960000","宇真工程顧問有限公司","711臺南市歸仁區南保里民權八街59號3樓",""
"award_20200101.xml","2020/01/01","2020/01/15","2020/01/06","2020/01/07","108A442","推動室內空氣品質自主管理示範及維護管理計畫","行政院環境保護署","100臺北市中正區中華路一段83號","王偉政 許惠琮","(02)23712121分機6504 2456","限制性招標(經公開評選或公開徵求)","勞務類","準用最有利標","11720000","明志科技大學","243新北市泰山區工專路84號",""
"award_20200101.xml","2020/01/01","2020/01/15","2020/01/06","2020/01/07","LEA0760007","永安廠至楠梓配氣站24吋備援管線鋪設可行性評估工作","台灣中油股份有限公司","110臺北市信義區松仁路3號19樓","蘇元辰","(02)87258303分機","限制性招標(經公開評選或公開徵求)","勞務類","準用最有利標","28200000","萬鼎工程服務股份有限公司","111臺北市士林區中山北路6段89號10樓","艾奕康工程顧問股份有限公司"
"award_20200101.xml","2020/01/01","2020/01/15","2020/01/06","2020/01/09","10906SA026","109年度中區等樹木修剪維護及緊急搶修工作（開口契約）","高雄市政府工務局養護工程處","802高雄市苓雅區四維三路2號5樓","四維養護工程隊陳宥臣","(07)3421418分機1201","公開招標","勞務類","最低標","4920000","泳金企業有限公司","807高雄市三民區建興路20號","柏森園藝有限公司"
"award_20200101.xml","2020/01/01","2020/01/15","2020/01/06","2020/01/13","109e700032","虎尾園區景觀及清潔維護工作(109年度)","科技部中部科學工業園區管理局","407臺中市西屯區中科路2號","趙庭佑(規範)/陳家榮(招標)","(04)25658588分機7636/6925","限制性招標(經公開評選或公開徵求)","勞務類","準用最有利標","11332431","友信造園社","510彰化縣員林市振興里山腳路二段589巷272號","淼森工程有限公司"
"award_20200101.xml","2020/01/01","2020/01/15","2020/01/06","2020/01/13","109e700052","中興園區景觀及清潔維護工作(109-110年度)","科技部中部科學工業園區管理局","407臺中市西屯區中科路2號","趙庭佑(規範)/陳家榮(招標)","(04)25658588分機7636/6925","限制性招標(經公開評選或公開徵求)","勞務類","準用最有利標","12600000","淼森工程有限公司","435臺中市梧棲區大村里28鄰立德街289巷11號1樓","友信造園社"
"award_20200101.xml","2020/01/01","2020/01/15","2020/01/07","2020/01/16","B108250","第八海巡隊澎湖艦108年度歲修案","海洋委員會海巡署艦隊分署","251新北市淡水區中正路一段63巷20號","王光德","(02)28053990分機362416","公開招標","財物類","最低標","5900000","裕順船舶機械工程用品行(合夥)","807高雄市三民區安和里松江街426號",""
"award_20200101.xml","2020/01/01","2020/01/15","2020/01/07","2020/01/15","109C008","109年河川污染防治管理及水體改善業務推動計畫","行政院環境保護署","100臺北市中正區中華路一段83號","李文慶 許惠琮","(02)23117722分機2817 2456","公開招標","勞務類","最低標","8550000","得士派科技股份有限公司","114臺北市內湖區新明路460巷12號1樓",""
"award_20200101.xml","2020/01/01","2020/01/15","2020/01/07","2020/01/08","C1081052","109年全市污水下水道系統維護開口契約工程委託設計監造","高雄市政府水利局","830高雄市鳳山區光復路二段132號","污水營運科-李明憲","(07)7995678分機2202","限制性招標(經公開評選或公開徵求)","勞務類","準用最有利標","4686222","萬鼎工程服務股份有限公司","111臺北市士林區中山北路6段89號10樓","聯聖工程顧問股份有限公司"
"award_20200101.xml","2020/01/01","2020/01/15","2020/01/07","2020/01/08","320-10912","109年度聯合污水處理廠臨海廠污泥委託代清理工作","經濟部工業局","812高雄市小港區鳳北路4號","王仁宏","(07)8712620分機7609","公開招標","勞務類","最低標","8452400","弘偉環保工程股份有限公司","807高雄市三民區九如一路61號10樓","家肯環保科技有限公司"
"award_20200101.xml","2020/01/01","2020/01/15","2020/01/07","2020/01/08","U8F07D118-1","燒鹼溶液(Sodium Hydroxide)","台灣中油股份有限公司石化事業部","832高雄市林園區五福里石化二路3號","林宥秀","(07)6413701分機8734","限制性招標(未經公開評選或公開徵求)","財物類","最低標","82740000","南鋼工業原料有限公司","830高雄市鳳山區文龍路59號2樓",""
"award_20200101.xml","2020/01/01","2020/01/15","2020/01/07","2020/01/08","B1081136","109年度中區污水處理廠初沉池及濃縮脫水站代操作及維護開口契約","高雄市政府水利局","830高雄市鳳山區光復路二段132號","污水營運科-彭信源","(07)5714161分機117","公開招標","勞務類","最低標","6993700","台耐企業有限公司","802高雄市苓雅區文昌路41巷12號",""
"award_20200101.xml","2020/01/01","2020/01/15","2020/01/07","2020/01/14","BM-08-1101-07","鳥嘴潭人工湖下游─送水管A-2","台灣自來水股份有限公司","404臺中市北區雙十路二段2號之1","黃敏華","(04)22244191分機791","公開招標","工程類","最低標","223500000","祐昆營造有限公司","710臺南市永康區永和街199號","國統國際股份有限公司"
"award_20200101.xml","2020/01/01","2020/01/15","2020/01/07","2020/01/15","TVG109P-02","磁振造影系統等3項設備採購案","臺中榮民總醫院","407臺中市西屯區臺灣大道四段1650號","項玫茹","(04)23592525分機2815","公開招標","財物類","最低標","46060000","醫影股份有限公司","110臺北市信義區忠孝東路5段510號19樓之2","億陽企業有限公司"
"award_20200101.xml","2020/01/01","2020/01/15","2020/01/07","2020/02/03","0080800035","桿上變壓器單相6.9kV-240/120V 10kVA不鏽鋼","台灣電力股份有限公司","100臺北市中正區羅斯福路3段242號8樓","卓祥敬","(02)23666808分機","公開招標","財物類","最低標","23100000","連距電機股份有限公司","327桃園市新屋區清華一街190號",""
"award_20200101.xml","2020/01/01","2020/01/15","2020/01/07","2020/01/09","GF2-108002","複合光纖地線及附屬器材乙批(B組)","臺灣銀行股份有限公司","100臺北市中正區武昌街一段45號","開標二科","(02)23497673分機","公開招標","財物類","最低標","9074443","LS Cable & System Ltd.","99912-17F, LS Tower, 127 LS-ro, Dongan-gu, Anyang-si, Gyeonggi-do, 14119, Korea",""
"award_20200101.xml","2020/01/01","2020/01/15","2020/01/07","2020/01/08","N1H08A025","一貫式研磨設備(採購帶安裝)","台灣中油股份有限公司","110臺北市信義區松仁路3號19樓","簡光廷","(02)87258334分機","公開招標","財物類","最低標","69500000","丹特科技有限公司","100臺北市中正區忠孝東路2段80號7樓",""
"award_20200101.xml","2020/01/01","2020/01/15","2020/01/07","2020/01/09","1082B15a","延性鑄鐵管100m/m、200m/m(K型第三種)等乙批","台灣自來水股份有限公司第十一區管理處","500彰化縣彰化市桃源里公園路2段1號","林彥男","(04)7245031分機790","公開招標","財物類","最低標","46674075","錦源鑄造工業股份有限公司","104臺北市中山區建國北路1段69號9樓",""
"award_20200101.xml","2020/01/01","2020/01/15","2020/01/07","2020/01/10","108C010P073","中分局一般勞務作業工作109年2月至110年1月-A南投B斗南C大甲D苗栗","交通部高速公路局中區養護工程分局","407臺中市西屯區臺灣大道4段5巷55號","黃筱媁工程司","(04)22529181分機2212","公開招標","勞務類","最低標","195900000","崇萱景觀營造有限公司","514彰化縣溪湖鎮湖東里向上二街13號1樓",""
"award_20200101.xml","2020/01/01","2020/01/15","2020/01/07","2020/01/10","3500809037","109年度核一廠除役工程DCRD/SERT評估設計系統設備拆除圖面結構體檢查工作","台灣電力股份有限公司第一核能發電廠","253新北市石門區乾華里小坑12號","黃昭仁","(02)26383501分機3641","限制性招標(未經公開評選或公開徵求)","勞務類","最低標","33705000","益鼎工程股份有限公司","111臺北市士林區中山北路6段89號10樓",""
"award_20200101.xml","2020/01/01","2020/01/15","2020/01/07","2020/01/10","1085B1907","台19甲線56K+000~57K+550段拓寬暨南雄橋改建工程委託測量、設計、地質探查及環評書件變更服務工作","交通部公路總局第五區養護工程處","60001嘉義市東區安和街209號","企劃科-蘇文傑","(05)2782861分機2602","限制性招標(經公開評選或公開徵求)","勞務類","準用最有利標","13621871","建業工程顧問有限公司","100臺北市中正區忠孝東路2段122號8樓","黎明工程顧問股份有限公司"
"award_20200101.xml","2020/01/01","2020/01/15","2020/01/07","2020/01/09","108C120P013","採購國道6號隧道照明燈具等設備(含安裝)","交通部高速公路局中區養護工程分局","407臺中市西屯區臺灣大道4段5巷55號","陳彥宇","(04)22529181分機2312","公開招標","財物類","最低標","17643000","欣聯業工程有限公司","235新北市中和區保健路39巷7號",""
"award_20200101.xml","2020/01/01","2020/01/15","2020/01/07","2020/01/09","F108007","勞動學苑設施設備再造委託規劃、設計、監造案","勞動部勞動力發展署中彰投分署","407臺中市西屯區工業區一路100號","洪忠儀","(04)23592181分機1322","限制性招標(經公開評選或公開徵求)","勞務類","準用最有利標","6351815","黃貴帝建築師事務所","408臺中市南屯區大業路271號2樓",""
"award_20200101.xml","2020/01/01","2020/01/15","2020/01/07","2020/01/13","108052A046","次氯酸鈉6,000,000公斤乙批","台灣自來水股份有限公司第五區管理處","60001嘉義市東區民權路293號","陳宇昌","(05)2252670分機792","公開招標","財物類","最低標","28035000","合宜興業有限公司","60002嘉義市西區文山街108號",""
