"SourceFile","RangeStartDate","RangeEndDate","AwardDate","AwardNoticeDate","TenderCaseNo","TenderName","TenderOrgName","TenderOrgAddr","ContactPerson","TenderTel","ProcurementType","ProcurementAttr","TenderAwardWay","TenderAwardPrice","BidderSuppName","BidderSuppAddr","NotObtainSuppName"
"award_20200701.xml","2020/07/01","2020/07/15","2020/07/09","2020/07/15","LP5-109015","學生（童）團體保險","臺灣銀行股份有限公司","100臺北市中正區武昌街一段45號","開標二科陳先生","(02)23493456分機7678","限制性招標(經公開評選或公開徵求)","勞務類","準用最有利標","68900000","國泰人壽保險股份有限公司","106臺北市大安區仁愛路四段296號",""
"award_20200701.xml","2020/07/01","2020/07/15","2020/07/09","2020/07/14","3410900092","109-110興一~四機石灰石粉45000公噸","台灣電力股份有限公司興達發電廠","828高雄市永安區鹽田里興達路六號","李美穎","(07)6912811分機3356","公開招標","財物類","最低標","70213500","煜盛股份有限公司","221新北市汐止區新台五路1段79號16樓之8",""
"award_20200701.xml","2020/07/01","2020/07/15","2020/07/10","2020/08/05","UM090380","總分院及癌醫影像醫學部醫材5項單價合約招標案","國立臺灣大學醫學院附設醫院","100臺北市中正區中山南路7號","林沛穎","(02)23123456分機62036","選擇性招標(個案)","財物類","最低標","107121400","六霖企業有限公司","100臺北市中正區杭州南路1段19號10樓",""
"award_20200701.xml","2020/07/01","2020/07/15","2020/07/10","2020/07/28","101-5132-4-004-CM01-CCO-09","臺灣桃園國際機場聯外捷運系統暨延伸至中壢火車站建設計畫CM01區段標(第9次契約變更案)","交通部鐵道局北部工程處","235新北市中和區民安街170號","周宏昇","(02)82286888分機2118","限制性招標(未經公開評選或公開徵求)","工程類","最低標","284761359","大陸工程股份有限公司","106臺北市大安區敦化南路2段95號",""
"award_20200701.xml","2020/07/01","2020/07/15","2020/07/10","2020/07/21","3700900056","109~111年#1~#6氣渦輪機進氣室空氣過濾網等1批","台灣電力股份有限公司通霄發電廠","357苗栗縣通霄鎮海濱路1~31號","許宴甄","(037)752054分機522","公開招標","財物類","最低標","31090500","博宇欣通企業有限公司","814高雄市仁武區澄合四街23號1樓","凱優迪有限公司"
"award_20200701.xml","2020/07/01","2020/07/15","2020/07/10","2020/07/28","3410900159","興一機DCDAS控制器乙批(含安裝)","台灣電力股份有限公司興達發電廠","828高雄市永安區鹽田里興達路六號","吳玫華","(07)6912811分機3352","限制性招標(未經公開評選或公開徵求)","財物類","最低標","16065000","台灣英維思股份有限公司","114臺北市內湖區舊宗路2段189號5樓",""
"award_20200701.xml","2020/07/01","2020/07/15","2020/07/10","2020/07/15","B1090039510","109年度醫療影像儲存傳輸系統查詢設備採購案。","衛生福利部中央健康保險署","106臺北市大安區信義路三段140號14樓","規格黃小姐/採購羅小姐","(02)27065866分機1528/2731","公開招標","財物類","最低標","5358240","資拓宏宇國際股份有限公司","220新北市板橋區縣民大道2段7號6樓","合華科技股份有限公司"
"award_20200701.xml","2020/07/01","2020/07/15","2020/07/10","2020/07/24","10924105","「直線加速器放射治療機暨近接治療儀」二年期維護保養","臺北榮民總醫院","112臺北市北投區石牌路2段201號","姚之若","(02)28712121分機7489","公開招標","勞務類","最低標","18550000","瓦里安台灣股份有限公司","106臺北市大安區敦化南路1段337號9樓",""
"award_20200701.xml","2020/07/01","2020/07/15","2020/07/10","2020/07/16","LP5-109021","洗衣機","臺灣銀行股份有限公司","100臺北市中正區武昌街一段45號","開標一科","(02)23493456分機7661","公開招標","財物類","最低標","35996250","賓赫企業有限公司","900屏東縣屏東市自立南路177號","東元電機股份有限公司"
"award_20200701.xml","2020/07/01","2020/07/15","2020/07/10","2020/07/16","0080920024","高屏發電廠竹門機組水輪機配件採購","台灣電力股份有限公司","100臺北市中正區羅斯福路3段242號8樓","黃琳舒","(02)23666788分機","限制性招標(未經公開評選或公開徵求)","財物類","最低標","68179115","Voith Fuji Hydro K.K.","9991-1 Tanabeshinden, Kawasaki-ku, Kawasaki-Shi, 210-9530",""
"award_20200701.xml","2020/07/01","2020/07/15","2020/07/10","2020/07/14","10914","109年度傾卸工程車及吊桿工程車汰換案","臺北市政府工務局新建工程處","110臺北市信義區市府路一號南區五樓","廖瑞君/詹明怡","(02)27282609分機2609/7934","公開招標","財物類","最低標","9946000","有曜興業有限公司","104臺北市中山區新生北路1段83號6樓",""
"award_20200701.xml","2020/07/01","2020/07/15","2020/07/10","2020/07/13","NCREE-P-109045","振動台次世代動態資料擷取系統採購","財團法人國家實驗研究院國家地震工程研究中心","106臺北市大安區辛亥路三段200號","林小姐","(02)66300812分機","限制性招標(未經公開評選或公開徵求)","財物類","最低標","6840000","集研科技股份有限公司","114臺北市內湖區民權東路6段160號6樓之4",""
"award_20200701.xml","2020/07/01","2020/07/15","2020/07/10","2020/07/13","109050613","行政院主計總處「109年共通性普查資料處理資訊系統資訊服務案」勞務採購案。","行政院主計總處","100臺北市中正區台北市忠孝東路一段一號","王心怡","(02)33567537分機","限制性招標(經公開評選或公開徵求)","勞務類","準用最有利標","7760000","卓越動力資訊股份有限公司","100臺北市中正區八德路1段23號8樓之1",""
"award_20200701.xml","2020/07/01","2020/07/15","2020/07/10","2020/07/13","Q6F09D035","第十二蒸餾工場脫金屬劑1 ST","台灣中油股份有限公司","811高雄市楠梓區左楠路2號","徐綺縵","(07)5824141分機2645","公開招標","財物類","最低標","16052400","巨霖能源工程有限公司","800高雄市新興區民權一路251號27樓","連華工程企業有限公司"
"award_20200701.xml","2020/07/01","2020/07/15","2020/07/10","2020/07/13","D109-N137","藥品","國立成功大學醫學院附設醫院","704臺南市北區勝利路138號","吳雅萍","(06)2353535分機4534","選擇性招標(個案)","財物類","最低標","9350400","大隆興藥品股份有限公司","104臺北市中山區錦州街4巷1號1樓","裕利股份有限公司"
"award_20200701.xml","2020/07/01","2020/07/15","2020/07/13","2020/07/20","10938","109年居家防疫米糧產品創意行銷計畫","行政院農業委員會農糧署","100臺北市中正區杭州南路一段15號","高庭芳(採購單位)/王欣俞(請購需求單位)","(02)23937231分機111/593","限制性招標(經公開評選或公開徵求)","勞務類","準用最有利標","9500000","三立電視股份有限公司","114臺北市內湖區舊宗路1段159號1樓","東森電視事業股份有限公司"
"award_20200701.xml","2020/07/01","2020/07/15","2020/07/13","2020/07/21","YH109034","109年度儲存設備擴充快閃硬碟及交換器採購案","衛生福利部疾病管制署","100臺北市中正區林森南路6號","胡育昇3608/曹瀛心3703","(02)23959825分機3703","公開招標","財物類","最低標","5120000","藍新資訊股份有限公司","114臺北市內湖區行忠路42號2樓",""
"award_20200701.xml","2020/07/01","2020/07/15","2020/07/13","2020/07/14","L70084004","永安廠東北碼頭靠船監視系統(含安裝測試)(Purchasing Specification for BMS)","台灣中油股份有限公司","110臺北市信義區松仁路3號19樓","詹玉圓","(02)87258340分機","公開招標","財物類","最低標","18579750","萬壽興業股份有限公司","111臺北市士林區中山北路7段82巷27號1樓",""
"award_20200701.xml","2020/07/01","2020/07/15","2020/07/13","2020/07/14","1090020042C","109年度下半年至110年度上半年 南一版教材","僑務委員會","100臺北市中正區徐州路5號15-17樓","陳思羽","(02)23272769分機","限制性招標(未經公開評選或公開徵求)","財物類","最低標","5620000","南一書局企業股份有限公司","701臺南市東區東門里北門路一段76號1至2樓",""
"award_20200701.xml","2020/07/01","2020/07/15","2020/07/13","2020/07/16","1090543","109年度外文圖書共同供應契約","國立臺灣大學","106臺北市大安區羅斯福路4段1號（行政大樓採購組）","林芥綸","(02)33662196分機213","公開招標","財物類","最低標","273952381","文景書局有限公司","106臺北市大安區和平東路1段91號4樓","冠唐國際圖書股份有限公司"
"award_20200701.xml","2020/07/01","2020/07/15","2020/07/13","2020/07/17","1094B037","台9線太魯閣大橋及台11線新長虹橋鋼索監測工作","交通部公路總局第四區養護工程處","270宜蘭縣蘇澳鎮中山路2段3號","養護科曾威修","(03)9962501分機2305","限制性招標(經公開評選或公開徵求)","勞務類","準用最有利標","16895751","國立中央大學","320桃園市中壢區中大路300號",""
"award_20200701.xml","2020/07/01","2020/07/15","2020/07/13","2020/07/17","109-0027IJ","高屏業務組8人乘、15人乘及25人乘3台電梯汰舊換新","衛生福利部中央健康保險署","801高雄市前金區中正四路259號","葉弘年","(07)2315151分機3122","公開招標","財物類","最低標","6300000","永大機電工業股份有限公司高雄分公司","802高雄市苓雅區大順三路200號","六川電梯工業股份有限公司"
"award_20200701.xml","2020/07/01","2020/07/15","2020/07/13","2020/07/16","109A273","國際溫室氣體管理減量制度研析與交流合作計畫","行政院環境保護署","100臺北市中正區中華路一段83號","高俊璿","(02)23117722分機2773","限制性招標(經公開評選或公開徵求)","勞務類","準用最有利標","5800000","永智顧問有限公司","412臺中市大里區東湖里科技路3號10樓之7",""
"award_20200701.xml","2020/07/01","2020/07/15","2020/07/13","2020/07/29","0770900003","DREAMS功能擴大(含資安防護、再生能源發電預測系統)」設備採購案","台灣電力股份有限公司","100臺北市中正區羅斯福路3段242號6樓","許淑華","(02)23666663分機","公開招標","財物類","最低標","32790001","中華電信股份有限公司企業客戶分公司","106臺北市大安區信義路4段88號16樓","優必闊科技股份有限公司"
"award_20200701.xml","2020/07/01","2020/07/15","2020/07/13","2020/07/15","109CA4006","代辦南方澳跨港大橋重建工程及配合管線工程","交通部公路總局蘇花公路改善工程處","270宜蘭縣蘇澳鎮蘇新路101號","陳勝雄","(03)9592000分機133","公開招標","工程類","最有利標","848500000","新亞建設開發股份有限公司","105臺北市松山區八德路4段760號15-16樓","璉嶸營造有限公司"
"award_20200701.xml","2020/07/01","2020/07/15","2020/07/14","2020/07/20","NS1090641","先導型化學除污設備","行政院原子能委員會核能研究所","325桃園市龍潭區佳安里文化路1000號","姜蔚宗 申請人謝賢德 分機 5817","(03)4711400分機2392","公開招標","財物類","最低標","5535000","斯凱益企業有限公司","338桃園市蘆竹區中興路67號",""
"award_20200701.xml","2020/07/01","2020/07/15","2020/07/14","2020/07/31","BE2020-02-01","108學年度圖書採購","高雄市立福山國民中學","813高雄市左營區重信路215號","梁金臺","(07)3501581分機35","公開招標","財物類","最有利標","42802320","圖龍文化事業股份有限公司","830高雄市鳳山區文清街三二號五樓","捷勝文教企業社(獨資)"
"award_20200701.xml","2020/07/01","2020/07/15","2020/07/14","2020/08/06","NCCW109014","5G行動寬頻基地臺測試儀採購案","國家通訊傳播委員會","100臺北市中正區仁愛路1段50號","詹德偉","(02)33438737分機","公開招標","財物類","最低標","630000","華智通信股份有限公司","114臺北市內湖區瑞光路584號7樓","弘諺科技股份有限公司"
"award_20200701.xml","2020/07/01","2020/07/15","2020/07/14","2020/07/21","A3E001052","高雄港第七貨櫃中心計畫-S4~S5櫃場設施工程","臺灣港務股份有限公司高雄港務分公司","804高雄市鼓山區蓬萊二路1號","陳金川","(07)5622106分機","公開招標","工程類","最低標","2533000000","壹山營造工程股份有限公司","800高雄市新興區東海街214號1樓","開源營造股份有限公司"
"award_20200701.xml","2020/07/01","2020/07/15","2020/07/14","2020/07/17","2109KSPTDS01","109-110年度高雄市及屏東縣水土保持、農村及農路工程委託設計監造技術服務","行政院農業委員會水土保持局臺南分局","701臺南市東區林森路一段316號","許晉豪","(06)2684367分機4119","限制性招標(經公開評選或公開徵求)","勞務類","準用最有利標","17766000","宇真工程顧問有限公司","711臺南市歸仁區南保里民權八街59號3樓","睿泰工程顧問有限公司"
"award_20200701.xml","2020/07/01","2020/07/15","2020/07/14","2020/07/16","1092A22","氯化鐵乙批","台灣自來水股份有限公司第六區管理處","700臺南市中西區南門路22號","梁銘峰","(06)2138101分機791","公開招標","財物類","最低標","48182400","中懋化學股份有限公司","710臺南市永康區王行里經華路6號",""
"award_20200701.xml","2020/07/01","2020/07/15","2020/07/14","2020/07/22","DB-09-0201-13","109年中壢所水壓水量傳訊設備更新增設","台灣自來水股份有限公司第二區管理處","324桃園市平鎮區水廠路150號","黃韻儒","(03)4643131分機791","公開招標","財物類","最低標","19150000","銓準科技有限公司","741臺南市善化區南科九路16號",""
"award_20200701.xml","2020/07/01","2020/07/15","2020/07/14","2020/07/22","LP5-109033","大專校院校外實習學生團體保險","臺灣銀行股份有限公司","100臺北市中正區武昌街一段45號","開標二科黃先生","(02)23493456分機7676","公開招標","勞務類","最低標","24777788","新光產物保險股份有限公司","104臺北市中山區建國北路二段13號11樓",""
"award_20200701.xml","2020/07/01","2020/07/15","2020/07/14","2020/07/15","1090603001","岡山焚化廠飛灰穩定化物處理暨清運服務工作","台灣糖業股份有限公司環保事業營運中心","820高雄市岡山區本洲里本工五路9號","林聿祥","(07)6241168分機305","公開招標","勞務類","最低標","164400000","永盛開發實業股份有限公司","337桃園市大園區田心里2鄰田心27之2號",""
"award_20200701.xml","2020/07/01","2020/07/15","2020/07/14","2020/07/15","4800900102","108年國安等五所ALSTOM製GIS維護材料採購含安裝一批","台灣電力股份有限公司台中供電區營運處","413臺中市霧峰區民生路193號","楊新惠","(04)23335627分機408","限制性招標(未經公開評選或公開徵求)","財物類","最低標","73762500","台灣奇異電力股份有限公司","104臺北市中山區民生東路3段8號6樓",""
"award_20200701.xml","2020/07/01","2020/07/15","2020/07/14","2020/07/15","L5008K029","台中廠光伏發電系統(含安裝測試)","台灣中油股份有限公司","110臺北市信義區松仁路3號19樓","詹玉圓","(02)87258340分機","公開招標","財物類","最低標","8905880","佳得股份有限公司","221新北市汐止區新台五路1段97號22樓之2","鐙鋒綠能科技股份有限公司"
"award_20200701.xml","2020/07/01","2020/07/15","2020/07/14","2020/07/15","2550900023","天輪分廠#2、#3機調速機、制壓機與主閥控制系統採購含安裝","台灣電力股份有限公司大甲溪發電廠","424臺中市和平區天輪里東關路2段89-1號","孫昱廷","(04)25941574分機620","公開招標","財物類","最低標","46042500","巨路國際股份有限公司","115臺北市南港區園區街3之1號12樓","冠升興業股份有限公司"
"award_20200701.xml","2020/07/01","2020/07/15","2020/07/14","2020/07/15","B1090325","美濃湖排水泰順橋及其上游治理工程等美濃地區相關工程委託設計監造技術服務案","高雄市政府水利局","830高雄市鳳山區光復路二段132號","區排科-黃琮裕","(07)7995678分機2145","限制性招標(經公開評選或公開徵求)","勞務類","準用最有利標","7991231","佳綸工程科技有限公司","830高雄市鳳山區永安街96號","高標工程顧問有限公司"
"award_20200701.xml","2020/07/01","2020/07/15","2020/07/14","2020/07/15","1093B051","手動、電動立式彈性座封閘閥及電動立式蝶型閥等1批（部分含試車）","台灣自來水股份有限公司","404臺中市北區雙十路二段2號之1","陳威宇","(04)22244191分機802","公開招標","財物類","最低標","20170000","明冠造機企業股份有限公司","811高雄市楠梓區加昌路635號",""
"award_20200701.xml","2020/07/01","2020/07/15","2020/07/14","2020/07/15","B109334","第四(台南)海巡隊PP-10025艇109年度2部主機大修後續維修案","海洋委員會海巡署艦隊分署","251新北市淡水區中正路一段63巷20號","蔡孟融","(02)28053990分機362416","公開招標","財物類","最低標","11500000","海澄企業有限公司","805高雄市旗津區中洲二路60之7號",""
"award_20200701.xml","2020/07/01","2020/07/15","2020/07/15","2020/07/21","NCHC-P-109117","雲端服務平台之軟硬體第二期建置案","財團法人國家實驗研究院國家高速網路與計算中心","30001新竹市東區研發六路7號","彭琦茹","(03)5776085分機402","限制性招標(未經公開評選或公開徵求)","財物類","最低標","21139520","中華電信股份有限公司臺灣北區電信分公司","100臺北市中正區東門里仁愛路1段42號",""
"award_20200701.xml","2020/07/01","2020/07/15","2020/07/15","2020/07/21","1090523","中埔及水上產業園區設置委託技術服務案","經濟部工業局","106臺北市大安區信義路3段41之3號","鄭宇晴","(02)27541255分機2814","限制性招標(經公開評選或公開徵求)","勞務類","準用最有利標","70300000","台灣世曦工程顧問股份有限公司","114臺北市內湖區湖元里陽光街323號","中興工程顧問股份有限公司"
"award_20200701.xml","2020/07/01","2020/07/15","2020/07/15","2020/07/20","D109-N138","藥品","國立成功大學醫學院附設醫院","704臺南市北區勝利路138號","吳雅萍","(06)2353535分機4534","選擇性招標(個案)","財物類","最低標","70548840","台灣大昌華嘉股份有限公司","114臺北市內湖區堤頂大道2段407巷20弄1、3、5、7號10樓，及407巷22、24、26號10樓及407巷22號10樓之1","杏昌醫藥科技股份有限公司"
"award_20200701.xml","2020/07/01","2020/07/15","2020/07/15","2020/07/21","1090525","北高雄產業園區設置委託技術服務案","經濟部工業局","106臺北市大安區信義路3段41之3號","鄭宇晴","(02)27541255分機2814","限制性招標(經公開評選或公開徵求)","勞務類","準用最有利標","34200000","開新工程顧問股份有限公司","104臺北市中山區南京東路2段36號4樓","城都國際開發規劃管理顧問有限公司"
"award_20200701.xml","2020/07/01","2020/07/15","2020/07/15","2020/08/17","HD09E10A","移植檢驗試劑乙批","國立臺灣大學醫學院附設醫院新竹分院","30003新竹市北區經國路一段442巷25號","廖女清","(03)5326151分機6601","公開招標","財物類","最低標","15773299","太暘生物科技股份有限公司","221新北市汐止區福德三路369號12樓",""
"award_20200701.xml","2020/07/01","2020/07/15","2020/07/15","2020/07/20","UM081700","總分院及癌醫中心醫院手術室醫材一批單價合約招標案","國立臺灣大學醫學院附設醫院","100臺北市中正區中山南路7號","黃怡甄","(02)23562050分機","選擇性招標(個案)","財物類","最低標","223274900","集康國際股份有限公司","235新北市中和區中正路880號17樓之1","台灣亞衛有限公司"
"award_20200701.xml","2020/07/01","2020/07/15","2020/07/15","2020/07/21","1090524","新市產業園區設置委託技術服務案","經濟部工業局","106臺北市大安區信義路3段41之3號","鄭宇晴","(02)27541255分機2814","限制性招標(經公開評選或公開徵求)","勞務類","準用最有利標","41470000","長豐工程顧問股份有限公司","403臺中市西區忠明南路138號6樓之3",""
"award_20200701.xml","2020/07/01","2020/07/15","2020/07/15","2020/08/04","109014","109年度機房雲端服務設備維護案","高雄市立中正高級工業職業學校","806高雄市前鎮區光華二路80號","陳姿云","(07)7232301分機520","限制性招標(經公開評選或公開徵求)","勞務類","準用最有利標","9150000","敦陽資訊股份有限公司","30001新竹市東區東大路二段83號11樓之2",""
"award_20200701.xml","2020/07/01","2020/07/15","2020/07/15","2020/07/23","109-E-36","109年度臺灣海域之海漂(底)廢棄物清除計畫","海洋委員會海洋保育署","806高雄市前鎮區成功二路25號7樓","林信宏","(07)3382057分機262335","限制性招標(經公開評選或公開徵求)","勞務類","準用最有利標","4900000","永力海洋工程有限公司","220新北市板橋區三民路2段153巷4弄16之1號",""
"award_20200701.xml","2020/07/01","2020/07/15","2020/07/15","2020/07/23","IA109034","「109年度海關5部機動式貨櫃檢查儀之特殊零組件」財物採購","財政部關務署基隆關","200基隆市仁愛區港西街六號","楊昇隆","(02)24202951分機6161","公開招標","財物類","最低標","1710000","東駒股份有限公司","235新北市中和區建一路176號5樓之3",""
"award_20200701.xml","2020/07/01","2020/07/15","2020/07/15","2020/07/23","UM081690","總分院及癌醫中心醫院手術室醫材一批單價合約招標案","國立臺灣大學醫學院附設醫院","100臺北市中正區中山南路7號","黃怡甄","(02)23562050分機","選擇性招標(個案)","財物類","最低標","22803600","瑞士商愛爾康大藥廠股份有限公司台灣分公司","100臺北市中正區臺北市中正區仁愛路二段99號11樓",""
"award_20200701.xml","2020/07/01","2020/07/15","2020/07/15","2020/07/24","YM090150","鎖定加壓髖部骨板系統，單價合約","國立臺灣大學醫學院附設醫院雲林分院","640雲林縣斗六市雲林路二段579號","林枝香","(05)5323911分機2227","選擇性招標(個案)","財物類","最低標","59429000","普營股份有限公司","403臺中市西區公民里五權路2-106號19樓、2-107號19樓",""
"award_20200701.xml","2020/07/01","2020/07/15","2020/07/14","2020/07/17","D31099001-1","109年度「經濟部對受嚴重特殊傳染性肺炎影響發生營運困難事業資金紓困振興貸款及利息補貼作業經理銀行計畫」契約變更","經濟部中小企業處","106臺北市大安區台北市羅斯福路2段95號3樓","彭瑞珠","(02)23662351分機","限制性招標(未經公開評選或公開徵求)","勞務類","最低標","138600000","臺灣中小企業銀行股份有限公司","103臺北市大同區玉泉里9鄰塔城街30號",""
"award_20200701.xml","2020/07/01","2020/07/15","2020/07/14","2020/07/22","1090048","109年度歐洲觀光推廣暨海外行銷活動","臺北市政府觀光傳播局","110臺北市信義區市府路1號4樓中央區觀光傳播局","呂文述","(02)27208889分機3371","限制性招標(經公開評選或公開徵求)","勞務類","準用最有利標","4500000","哈台創意觀光行銷有限公司","110臺北市信義區松德路171號9樓之2","禾創國際股份有限公司"
"award_20200701.xml","2020/07/01","2020/07/15","2020/07/14","2020/07/22","DB-09-0201-12","109年桃園所桃園蘆竹區水壓水量傳訊設備更新增設","台灣自來水股份有限公司第二區管理處","324桃園市平鎮區水廠路150號","黃韻儒","(03)4643131分機791","公開招標","財物類","最低標","18180000","銓準科技有限公司","741臺南市善化區南科九路16號",""
"award_20200701.xml","2020/07/01","2020/07/15","2020/07/15","2020/07/21","1090522","褒忠產業園區設置委託技術服務案","經濟部工業局","106臺北市大安區信義路3段41之3號","鄭宇晴","(02)27541255分機2814","限制性招標(經公開評選或公開徵求)","勞務類","準用最有利標","41040000","惇陽工程顧問有限公司","104臺北市中山區南京東路3段19號9樓","開全工程顧問股份有限公司"
"award_20200701.xml","2020/07/01","2020/07/15","2020/07/15","2020/07/17","1090430S0083","109-111年紅隊演練暨第三方資安稽核及驗證服務","臺北市政府","110臺北市信義區巿府路一號3樓南區","陳瑞祥","(02)27208889分機1135","限制性招標(經公開評選或公開徵求)","勞務類","準用最有利標","11593000","戴夫寇爾股份有限公司","104臺北市中山區復興北路168號10樓","如梭世代有限公司"
"award_20200701.xml","2020/07/01","2020/07/15","2020/07/15","2020/07/16","DEB0841006","王田至太保中繼站8吋Y2管線智慧型通管器IP檢測工作","台灣中油股份有限公司","110臺北市信義區松仁路3號19樓","蔡介山","(02)87258335分機","公開招標","勞務類","最低標","29544538","邦華營造有限公司","104臺北市中山區復興北路2號4樓之8","信陵企業有限公司"
